,full_text,tweet_english
403,dukung sih sbnrnya ga masalah bang masalah pakta integritas serta isi kalau dan ikut dukung anies terang2an keluar pakta integritas tulis yakin kalau ribut ga besar sekarang,MYMEMORY WARNING: YOU USED ALL AVAILABLE FREE TRANSLATIONS FOR TODAY. NEXT AVAILABLE IN  04 HOURS 44 MINUTES 32 SECONDS VISIT HTTPS://MYMEMORY.TRANSLATED.NET/DOC/USAGELIMITS.PHP TO TRANSLATE MORE
404,kalau anies udah pasti anies kalah kek koalisi ntu suka diem ketek kuasa soal awokwowkowk,MYMEMORY WARNING: YOU USED ALL AVAILABLE FREE TRANSLATIONS FOR TODAY. NEXT AVAILABLE IN  04 HOURS 44 MINUTES 30 SECONDS VISIT HTTPS://MYMEMORY.TRANSLATED.NET/DOC/USAGELIMITS.PHP TO TRANSLATE MORE
405,pranowo tekan konsep negara hukum substansial jamin sejahtera umum sedantidakan negara hukum asing muka anies baswedan jamin konstitusional nicky fahrizal,MYMEMORY WARNING: YOU USED ALL AVAILABLE FREE TRANSLATIONS FOR TODAY. NEXT AVAILABLE IN  04 HOURS 44 MINUTES 29 SECONDS VISIT HTTPS://MYMEMORY.TRANSLATED.NET/DOC/USAGELIMITS.PHP TO TRANSLATE MORE
406,benar anies milik gagas jelas jelas mbulet tak sesuai data visi ubah original visi jelas kopas program jokowi visi sangat janji cepat program jokowi indonesia emas dukung tak jalan jokowi,MYMEMORY WARNING: YOU USED ALL AVAILABLE FREE TRANSLATIONS FOR TODAY. NEXT AVAILABLE IN  04 HOURS 44 MINUTES 27 SECONDS VISIT HTTPS://MYMEMORY.TRANSLATED.NET/DOC/USAGELIMITS.PHP TO TRANSLATE MORE
407,pak anies blagi pak bilang sendiri klo oposaudarii bisa bisnis jdi jugan bawa alas rekonsiliasi karenaa negara tidak lagi perang hahahhaa bisnis cuyyyy bisnis,MYMEMORY WARNING: YOU USED ALL AVAILABLE FREE TRANSLATIONS FOR TODAY. NEXT AVAILABLE IN  04 HOURS 44 MINUTES 25 SECONDS VISIT HTTPS://MYMEMORY.TRANSLATED.NET/DOC/USAGELIMITS.PHP TO TRANSLATE MORE
408,tahun ganti presiden amin presiden anies wakil cak imin amin maju negara bahagia rakyat nomor 1 pilih semua amin,MYMEMORY WARNING: YOU USED ALL AVAILABLE FREE TRANSLATIONS FOR TODAY. NEXT AVAILABLE IN  04 HOURS 44 MINUTES 24 SECONDS VISIT HTTPS://MYMEMORY.TRANSLATED.NET/DOC/USAGELIMITS.PHP TO TRANSLATE MORE
409,mas anies sih nyerang tendensius juara retorika timur etidak arab,MYMEMORY WARNING: YOU USED ALL AVAILABLE FREE TRANSLATIONS FOR TODAY. NEXT AVAILABLE IN  04 HOURS 44 MINUTES 22 SECONDS VISIT HTTPS://MYMEMORY.TRANSLATED.NET/DOC/USAGELIMITS.PHP TO TRANSLATE MORE
410,link gacor hari gaco daesang olivia batter up 100m views ginting gempa anies surabaya first lady pilih pranowo baik,MYMEMORY WARNING: YOU USED ALL AVAILABLE FREE TRANSLATIONS FOR TODAY. NEXT AVAILABLE IN  04 HOURS 44 MINUTES 20 SECONDS VISIT HTTPS://MYMEMORY.TRANSLATED.NET/DOC/USAGELIMITS.PHP TO TRANSLATE MORE
411,si kakek olympus ledak eyangslot wd 2 juta gaco olivia daesang juntidakook is coming ginting bangtan debut adidas gempa anies uncrush bts is coming,MYMEMORY WARNING: YOU USED ALL AVAILABLE FREE TRANSLATIONS FOR TODAY. NEXT AVAILABLE IN  04 HOURS 44 MINUTES 19 SECONDS VISIT HTTPS://MYMEMORY.TRANSLATED.NET/DOC/USAGELIMITS.PHP TO TRANSLATE MORE
412,anies mah emg gabakalan menang bang juga berani taruh 1 m,MYMEMORY WARNING: YOU USED ALL AVAILABLE FREE TRANSLATIONS FOR TODAY. NEXT AVAILABLE IN  04 HOURS 44 MINUTES 17 SECONDS VISIT HTTPS://MYMEMORY.TRANSLATED.NET/DOC/USAGELIMITS.PHP TO TRANSLATE MORE
413,nama tum ketua tantrum jadi dukung suka tantrum,MYMEMORY WARNING: YOU USED ALL AVAILABLE FREE TRANSLATIONS FOR TODAY. NEXT AVAILABLE IN  04 HOURS 44 MINUTES 16 SECONDS VISIT HTTPS://MYMEMORY.TRANSLATED.NET/DOC/USAGELIMITS.PHP TO TRANSLATE MORE
414,grassroot nya anies ini lah paling make sense,MYMEMORY WARNING: YOU USED ALL AVAILABLE FREE TRANSLATIONS FOR TODAY. NEXT AVAILABLE IN  04 HOURS 44 MINUTES 14 SECONDS VISIT HTTPS://MYMEMORY.TRANSLATED.NET/DOC/USAGELIMITS.PHP TO TRANSLATE MORE
415,org tres gagal cerna papar segala bentuk narasi ilmiyahnya capres cerdas kampung kakek2 umur 82 tahun tak kenal gedget nonton debat langsung bilang pak anies memang pintar arti kakek2 kerja sehari2 kebun lebih pintar yang naik mobil,MYMEMORY WARNING: YOU USED ALL AVAILABLE FREE TRANSLATIONS FOR TODAY. NEXT AVAILABLE IN  04 HOURS 44 MINUTES 13 SECONDS VISIT HTTPS://MYMEMORY.TRANSLATED.NET/DOC/USAGELIMITS.PHP TO TRANSLATE MORE
416,mau kisah bagaimana nama anies baswedan muncul partai nasdem jadi calon presiden sintidakat kisah mulai mei 2022 ketua umum nasdem surya paloh undang gubernur jakarta anies baswedan pulau tempat surya paloh rehat utas,MYMEMORY WARNING: YOU USED ALL AVAILABLE FREE TRANSLATIONS FOR TODAY. NEXT AVAILABLE IN  04 HOURS 44 MINUTES 11 SECONDS VISIT HTTPS://MYMEMORY.TRANSLATED.NET/DOC/USAGELIMITS.PHP TO TRANSLATE MORE
417,awokwokwok sangat beda realita emosional baru tnyak samaa anies kyak mana mau mimpin negara klo bangetu,MYMEMORY WARNING: YOU USED ALL AVAILABLE FREE TRANSLATIONS FOR TODAY. NEXT AVAILABLE IN  04 HOURS 44 MINUTES 09 SECONDS VISIT HTTPS://MYMEMORY.TRANSLATED.NET/DOC/USAGELIMITS.PHP TO TRANSLATE MORE
418,survei ipsos 1529 nov gibran lonjak 11 mahfud turun 9 amp aniesamauhaimin turun 6 banding survei 1719 okto abmi 2891 gt 2213 gpmmd 3198 gt 2295 psgrr 3132 gt 4266 undecided 779 gt 1226,MYMEMORY WARNING: YOU USED ALL AVAILABLE FREE TRANSLATIONS FOR TODAY. NEXT AVAILABLE IN  04 HOURS 44 MINUTES 08 SECONDS VISIT HTTPS://MYMEMORY.TRANSLATED.NET/DOC/USAGELIMITS.PHP TO TRANSLATE MORE
419,bapak di jelassin logika paling sederhana ma pak anies susah nantidakep palagi tim hore,MYMEMORY WARNING: YOU USED ALL AVAILABLE FREE TRANSLATIONS FOR TODAY. NEXT AVAILABLE IN  04 HOURS 44 MINUTES 06 SECONDS VISIT HTTPS://MYMEMORY.TRANSLATED.NET/DOC/USAGELIMITS.PHP TO TRANSLATE MORE
420,dukung sih sbnrnya ga masalah bang masalah pakta integritas serta isi kalau dan ikut dukung anies terang2an keluar pakta integritas tulis yakin kalau ribut ga besar sekarang,MYMEMORY WARNING: YOU USED ALL AVAILABLE FREE TRANSLATIONS FOR TODAY. NEXT AVAILABLE IN  04 HOURS 44 MINUTES 05 SECONDS VISIT HTTPS://MYMEMORY.TRANSLATED.NET/DOC/USAGELIMITS.PHP TO TRANSLATE MORE
421,pak anies jabat masih persekusi itu kalau dan biar hak cemas jika kita perlu cegah orang punya penting bisnis kuasa,MYMEMORY WARNING: YOU USED ALL AVAILABLE FREE TRANSLATIONS FOR TODAY. NEXT AVAILABLE IN  04 HOURS 44 MINUTES 03 SECONDS VISIT HTTPS://MYMEMORY.TRANSLATED.NET/DOC/USAGELIMITS.PHP TO TRANSLATE MORE
422,fpi pp jadi polisi sayaariah langsung bawah ym anies top,MYMEMORY WARNING: YOU USED ALL AVAILABLE FREE TRANSLATIONS FOR TODAY. NEXT AVAILABLE IN  04 HOURS 44 MINUTES 01 SECONDS VISIT HTTPS://MYMEMORY.TRANSLATED.NET/DOC/USAGELIMITS.PHP TO TRANSLATE MORE
423,anies si capres tipu tebar janji angin sorgawi layak jadi presiden gaco selamat pagi olivia surabaya pilih baik gpt45 adidas gempa,MYMEMORY WARNING: YOU USED ALL AVAILABLE FREE TRANSLATIONS FOR TODAY. NEXT AVAILABLE IN  04 HOURS 44 MINUTES 00 SECONDS VISIT HTTPS://MYMEMORY.TRANSLATED.NET/DOC/USAGELIMITS.PHP TO TRANSLATE MORE
424,nah kan anies emang punya data bahasa metafora ga mudah paham sama orang kurang gizi sama lulus sd kaya dukung nya cocok kasih program susu sama makan selamat siang gratis,MYMEMORY WARNING: YOU USED ALL AVAILABLE FREE TRANSLATIONS FOR TODAY. NEXT AVAILABLE IN  04 HOURS 43 MINUTES 58 SECONDS VISIT HTTPS://MYMEMORY.TRANSLATED.NET/DOC/USAGELIMITS.PHP TO TRANSLATE MORE
425,wonogiri baliho pragib rusak kok banyak ga semua laku bukan dukung anies,MYMEMORY WARNING: YOU USED ALL AVAILABLE FREE TRANSLATIONS FOR TODAY. NEXT AVAILABLE IN  04 HOURS 43 MINUTES 57 SECONDS VISIT HTTPS://MYMEMORY.TRANSLATED.NET/DOC/USAGELIMITS.PHP TO TRANSLATE MORE
426,anies kha orang bodoh kerdil hina tidak erti susah erti apa jelas anies bahkan yang benci fitnah karena cerdas sesimple sih jawab apa ada jugan baperan,MYMEMORY WARNING: YOU USED ALL AVAILABLE FREE TRANSLATIONS FOR TODAY. NEXT AVAILABLE IN  04 HOURS 43 MINUTES 55 SECONDS VISIT HTTPS://MYMEMORY.TRANSLATED.NET/DOC/USAGELIMITS.PHP TO TRANSLATE MORE
427,ga muntidakin pilih 02 grup wa emak2 masih benci sama bikin trauma dukung anies yang di pilkada akhir ria ganyang ahok penggal leher sangat bikin tenang makanya milih golput rela dukung siapa,MYMEMORY WARNING: YOU USED ALL AVAILABLE FREE TRANSLATIONS FOR TODAY. NEXT AVAILABLE IN  04 HOURS 43 MINUTES 54 SECONDS VISIT HTTPS://MYMEMORY.TRANSLATED.NET/DOC/USAGELIMITS.PHP TO TRANSLATE MORE
428,betul bos habis nonton 2 saudari buat jd gregetan amp ga bs tahan untuk sampai benar mrk jd itu efek capresnya rasa dipermalukanpadahal awal capres mrk malu anies lbh dulu pantas debat capres itu yang palin benar,MYMEMORY WARNING: YOU USED ALL AVAILABLE FREE TRANSLATIONS FOR TODAY. NEXT AVAILABLE IN  04 HOURS 43 MINUTES 52 SECONDS VISIT HTTPS://MYMEMORY.TRANSLATED.NET/DOC/USAGELIMITS.PHP TO TRANSLATE MORE
429,nah kan anies emang punya data bahasa metafora ga mudah paham sama orang kurang gizi sama lulus sd kaya dukung nya cocok kasih program susu sama makan selamat siang gratis,MYMEMORY WARNING: YOU USED ALL AVAILABLE FREE TRANSLATIONS FOR TODAY. NEXT AVAILABLE IN  04 HOURS 43 MINUTES 51 SECONDS VISIT HTTPS://MYMEMORY.TRANSLATED.NET/DOC/USAGELIMITS.PHP TO TRANSLATE MORE
430,subhanallah pak anies mantap,MYMEMORY WARNING: YOU USED ALL AVAILABLE FREE TRANSLATIONS FOR TODAY. NEXT AVAILABLE IN  04 HOURS 43 MINUTES 49 SECONDS VISIT HTTPS://MYMEMORY.TRANSLATED.NET/DOC/USAGELIMITS.PHP TO TRANSLATE MORE
431,corruption watch tekan anies baswedan pimpin dapat hadir ubah positif lalu kebijakankebijakan berbasaudari sejahtera,MYMEMORY WARNING: YOU USED ALL AVAILABLE FREE TRANSLATIONS FOR TODAY. NEXT AVAILABLE IN  04 HOURS 43 MINUTES 48 SECONDS VISIT HTTPS://MYMEMORY.TRANSLATED.NET/DOC/USAGELIMITS.PHP TO TRANSLATE MORE
432,ngomong edit arti gak nonton debat tsb,MYMEMORY WARNING: YOU USED ALL AVAILABLE FREE TRANSLATIONS FOR TODAY. NEXT AVAILABLE IN  04 HOURS 43 MINUTES 46 SECONDS VISIT HTTPS://MYMEMORY.TRANSLATED.NET/DOC/USAGELIMITS.PHP TO TRANSLATE MORE
433,anies pernah bilang sama rakyat indonesia buat apa musuh lama sajak komunikasi sajak diskus jadi musuh anies merantidakul siapa masuk dan gak pernah lihat harus dikte anies walaupun beliau dukung anies pilagiub dki,MYMEMORY WARNING: YOU USED ALL AVAILABLE FREE TRANSLATIONS FOR TODAY. NEXT AVAILABLE IN  04 HOURS 43 MINUTES 45 SECONDS VISIT HTTPS://MYMEMORY.TRANSLATED.NET/DOC/USAGELIMITS.PHP TO TRANSLATE MORE
434,balik nama gerindaria jd naik anies jd gubernur dki kl anies gamau terima tawar buat usung partai kyaknya nyungsep partai korup,MYMEMORY WARNING: YOU USED ALL AVAILABLE FREE TRANSLATIONS FOR TODAY. NEXT AVAILABLE IN  04 HOURS 43 MINUTES 43 SECONDS VISIT HTTPS://MYMEMORY.TRANSLATED.NET/DOC/USAGELIMITS.PHP TO TRANSLATE MORE
435,pasti aman pju polda banten pimpin aman kunjung calon presiden republik indonesia nomor urut 1 anies baswedan muhaimin iskandar kampung lelang ikan kronjo jumat 0112 polda banten,MYMEMORY WARNING: YOU USED ALL AVAILABLE FREE TRANSLATIONS FOR TODAY. NEXT AVAILABLE IN  04 HOURS 43 MINUTES 42 SECONDS VISIT HTTPS://MYMEMORY.TRANSLATED.NET/DOC/USAGELIMITS.PHP TO TRANSLATE MORE
436,kawan2 ku skrg ngebantu anies kapasitas apa stand fast amp hold your ground jugan mundur borok ny caprescawapres lo pd dikulik2 namany manusia ad salahny people are dirty ideas are pure so fight for their ideas instead,MYMEMORY WARNING: YOU USED ALL AVAILABLE FREE TRANSLATIONS FOR TODAY. NEXT AVAILABLE IN  04 HOURS 43 MINUTES 40 SECONDS VISIT HTTPS://MYMEMORY.TRANSLATED.NET/DOC/USAGELIMITS.PHP TO TRANSLATE MORE
437,sayaa jugaa dukung pak anies tak perlu lah pake kata ijtima ulama ulama dukung paslon jugaa banyak,MYMEMORY WARNING: YOU USED ALL AVAILABLE FREE TRANSLATIONS FOR TODAY. NEXT AVAILABLE IN  04 HOURS 43 MINUTES 38 SECONDS VISIT HTTPS://MYMEMORY.TRANSLATED.NET/DOC/USAGELIMITS.PHP TO TRANSLATE MORE
438,ini beda orang cerdas pintar punya wawas bangsa yangluas baik luar negeripasti banyak lirik partai unyuk usung dan jangan lupa kakek pak anies pahlawan nasional lo,MYMEMORY WARNING: YOU USED ALL AVAILABLE FREE TRANSLATIONS FOR TODAY. NEXT AVAILABLE IN  04 HOURS 43 MINUTES 37 SECONDS VISIT HTTPS://MYMEMORY.TRANSLATED.NET/DOC/USAGELIMITS.PHP TO TRANSLATE MORE
439,kritik jago ngomong betul bagus buat pak anies jika pilih jadi presiden ri jadi ingat bisa wujud semua janji kampanye wujud adil semua,MYMEMORY WARNING: YOU USED ALL AVAILABLE FREE TRANSLATIONS FOR TODAY. NEXT AVAILABLE IN  04 HOURS 43 MINUTES 35 SECONDS VISIT HTTPS://MYMEMORY.TRANSLATED.NET/DOC/USAGELIMITS.PHP TO TRANSLATE MORE
440,pasti aman pju polda banten pimpin aman kunjung calon presiden republik indonesia nomor urut 1 anies baswedan muhaimin iskandar kampung lelang ikan kronjo jumat 0112 polda banten,MYMEMORY WARNING: YOU USED ALL AVAILABLE FREE TRANSLATIONS FOR TODAY. NEXT AVAILABLE IN  04 HOURS 43 MINUTES 34 SECONDS VISIT HTTPS://MYMEMORY.TRANSLATED.NET/DOC/USAGELIMITS.PHP TO TRANSLATE MORE
441,lu menang ga mulu kakcuriga gua lu pake sugih,MYMEMORY WARNING: YOU USED ALL AVAILABLE FREE TRANSLATIONS FOR TODAY. NEXT AVAILABLE IN  04 HOURS 43 MINUTES 32 SECONDS VISIT HTTPS://MYMEMORY.TRANSLATED.NET/DOC/USAGELIMITS.PHP TO TRANSLATE MORE
442,anies baswedan dekat bijak berbasaudari butuh rakyat jadi pilih jelas bawa indonesia arah lebih baik,MYMEMORY WARNING: YOU USED ALL AVAILABLE FREE TRANSLATIONS FOR TODAY. NEXT AVAILABLE IN  04 HOURS 43 MINUTES 30 SECONDS VISIT HTTPS://MYMEMORY.TRANSLATED.NET/DOC/USAGELIMITS.PHP TO TRANSLATE MORE
443,anies baswedan calon presiden harap mampu jawab tantang nyata programprogram inovatif sambung,MYMEMORY WARNING: YOU USED ALL AVAILABLE FREE TRANSLATIONS FOR TODAY. NEXT AVAILABLE IN  04 HOURS 43 MINUTES 29 SECONDS VISIT HTTPS://MYMEMORY.TRANSLATED.NET/DOC/USAGELIMITS.PHP TO TRANSLATE MORE
444,anies baswedan nilai pimpin mampu bawa ubah positif fokus kebijakankebijakan prorakyat,MYMEMORY WARNING: YOU USED ALL AVAILABLE FREE TRANSLATIONS FOR TODAY. NEXT AVAILABLE IN  04 HOURS 43 MINUTES 27 SECONDS VISIT HTTPS://MYMEMORY.TRANSLATED.NET/DOC/USAGELIMITS.PHP TO TRANSLATE MORE
445,anies baswedan usung semangat lanjut programprogramnya dapat jadi fondasi kuat menintidakatkan sejahtera masayaarakat indonesia,MYMEMORY WARNING: YOU USED ALL AVAILABLE FREE TRANSLATIONS FOR TODAY. NEXT AVAILABLE IN  04 HOURS 43 MINUTES 26 SECONDS VISIT HTTPS://MYMEMORY.TRANSLATED.NET/DOC/USAGELIMITS.PHP TO TRANSLATE MORE
446,anies retorikagt planninggt realization semua jalan cuma modal citra,MYMEMORY WARNING: YOU USED ALL AVAILABLE FREE TRANSLATIONS FOR TODAY. NEXT AVAILABLE IN  04 HOURS 43 MINUTES 24 SECONDS VISIT HTTPS://MYMEMORY.TRANSLATED.NET/DOC/USAGELIMITS.PHP TO TRANSLATE MORE
447,bilang edit arti ga nonton acara debat nya tgl 12122023 jam 1900 2200,MYMEMORY WARNING: YOU USED ALL AVAILABLE FREE TRANSLATIONS FOR TODAY. NEXT AVAILABLE IN  04 HOURS 43 MINUTES 23 SECONDS VISIT HTTPS://MYMEMORY.TRANSLATED.NET/DOC/USAGELIMITS.PHP TO TRANSLATE MORE
448,anies baswedan bukan sekadar figur politik pimpin dapat andal hadap bagai tantang bangsa,MYMEMORY WARNING: YOU USED ALL AVAILABLE FREE TRANSLATIONS FOR TODAY. NEXT AVAILABLE IN  04 HOURS 43 MINUTES 21 SECONDS VISIT HTTPS://MYMEMORY.TRANSLATED.NET/DOC/USAGELIMITS.PHP TO TRANSLATE MORE
449,anies bisa aminsajadulu,MYMEMORY WARNING: YOU USED ALL AVAILABLE FREE TRANSLATIONS FOR TODAY. NEXT AVAILABLE IN  04 HOURS 43 MINUTES 19 SECONDS VISIT HTTPS://MYMEMORY.TRANSLATED.NET/DOC/USAGELIMITS.PHP TO TRANSLATE MORE
450,anies baswedan pimpin bukti jadi alternatif tarik ganti pimpin nilai kurang sukses,MYMEMORY WARNING: YOU USED ALL AVAILABLE FREE TRANSLATIONS FOR TODAY. NEXT AVAILABLE IN  04 HOURS 43 MINUTES 18 SECONDS VISIT HTTPS://MYMEMORY.TRANSLATED.NET/DOC/USAGELIMITS.PHP TO TRANSLATE MORE
451,si fahri gonggong trs cuekin sama aniesbrekekekkk,MYMEMORY WARNING: YOU USED ALL AVAILABLE FREE TRANSLATIONS FOR TODAY. NEXT AVAILABLE IN  04 HOURS 43 MINUTES 16 SECONDS VISIT HTTPS://MYMEMORY.TRANSLATED.NET/DOC/USAGELIMITS.PHP TO TRANSLATE MORE
452,hahaha kadariun goblok semua muslim bedah anies rijik mrk muslim radikal mulut keluar anning babi lonte mulu,MYMEMORY WARNING: YOU USED ALL AVAILABLE FREE TRANSLATIONS FOR TODAY. NEXT AVAILABLE IN  04 HOURS 43 MINUTES 15 SECONDS VISIT HTTPS://MYMEMORY.TRANSLATED.NET/DOC/USAGELIMITS.PHP TO TRANSLATE MORE
453,tanggap masalah nasional anies baswedan tonjol komitmen beri solusi konkret hindar retorika tindak,MYMEMORY WARNING: YOU USED ALL AVAILABLE FREE TRANSLATIONS FOR TODAY. NEXT AVAILABLE IN  04 HOURS 43 MINUTES 13 SECONDS VISIT HTTPS://MYMEMORY.TRANSLATED.NET/DOC/USAGELIMITS.PHP TO TRANSLATE MORE
454,hasil anies baswedan programprogram sejahtera jadi landas kuat dapat dukung luas masayaarakat,MYMEMORY WARNING: YOU USED ALL AVAILABLE FREE TRANSLATIONS FOR TODAY. NEXT AVAILABLE IN  04 HOURS 43 MINUTES 12 SECONDS VISIT HTTPS://MYMEMORY.TRANSLATED.NET/DOC/USAGELIMITS.PHP TO TRANSLATE MORE
455,anies baswedan aku pimpin mampu kelola proyekproyek nasional efisiensi hasil muas,MYMEMORY WARNING: YOU USED ALL AVAILABLE FREE TRANSLATIONS FOR TODAY. NEXT AVAILABLE IN  04 HOURS 43 MINUTES 10 SECONDS VISIT HTTPS://MYMEMORY.TRANSLATED.NET/DOC/USAGELIMITS.PHP TO TRANSLATE MORE
456,cair,MYMEMORY WARNING: YOU USED ALL AVAILABLE FREE TRANSLATIONS FOR TODAY. NEXT AVAILABLE IN  04 HOURS 43 MINUTES 08 SECONDS VISIT HTTPS://MYMEMORY.TRANSLATED.NET/DOC/USAGELIMITS.PHP TO TRANSLATE MORE
457,gak paham jawab anies gak to de point tanya mau lanjuntukan ikn tinggal jawab iya tidak mutermulu biar liat intelek akhir gak jawab,MYMEMORY WARNING: YOU USED ALL AVAILABLE FREE TRANSLATIONS FOR TODAY. NEXT AVAILABLE IN  04 HOURS 43 MINUTES 07 SECONDS VISIT HTTPS://MYMEMORY.TRANSLATED.NET/DOC/USAGELIMITS.PHP TO TRANSLATE MORE
458,anies mimpi buruk besar generasi bangsa satu tolak anies gaco selamat pagi olivia surabaya gempa gemes daesang pilih baik,MYMEMORY WARNING: YOU USED ALL AVAILABLE FREE TRANSLATIONS FOR TODAY. NEXT AVAILABLE IN  04 HOURS 43 MINUTES 05 SECONDS VISIT HTTPS://MYMEMORY.TRANSLATED.NET/DOC/USAGELIMITS.PHP TO TRANSLATE MORE
459,dibandintidakan anies baswedan lebih andal beri solusi konkret masalahmasalah hadap indonesia,MYMEMORY WARNING: YOU USED ALL AVAILABLE FREE TRANSLATIONS FOR TODAY. NEXT AVAILABLE IN  04 HOURS 43 MINUTES 04 SECONDS VISIT HTTPS://MYMEMORY.TRANSLATED.NET/DOC/USAGELIMITS.PHP TO TRANSLATE MORE
460,hp goib stok tip buru,MYMEMORY WARNING: YOU USED ALL AVAILABLE FREE TRANSLATIONS FOR TODAY. NEXT AVAILABLE IN  04 HOURS 43 MINUTES 02 SECONDS VISIT HTTPS://MYMEMORY.TRANSLATED.NET/DOC/USAGELIMITS.PHP TO TRANSLATE MORE
461,anies baswedan calon presiden apresiasi fokus bangun lumbung pangan daerah provinsi nasional atas gagal jadi masa lalu,MYMEMORY WARNING: YOU USED ALL AVAILABLE FREE TRANSLATIONS FOR TODAY. NEXT AVAILABLE IN  04 HOURS 43 MINUTES 00 SECONDS VISIT HTTPS://MYMEMORY.TRANSLATED.NET/DOC/USAGELIMITS.PHP TO TRANSLATE MORE
462,anies baswedan hanya tawar janjijanji kosong programprogram konkret dapat atas bagai masalah indonesia,MYMEMORY WARNING: YOU USED ALL AVAILABLE FREE TRANSLATIONS FOR TODAY. NEXT AVAILABLE IN  04 HOURS 42 MINUTES 59 SECONDS VISIT HTTPS://MYMEMORY.TRANSLATED.NET/DOC/USAGELIMITS.PHP TO TRANSLATE MORE
463,pakai otak dulu singapura tiap tahun kirim asap tak ber ktapi taman tibet jadi contoh cemana masif tambah taman jakarta n bukti jakarta turun tintidakat polusi parkir air anies bukti banjir jakarta parah istana n bundar hi,MYMEMORY WARNING: YOU USED ALL AVAILABLE FREE TRANSLATIONS FOR TODAY. NEXT AVAILABLE IN  04 HOURS 42 MINUTES 57 SECONDS VISIT HTTPS://MYMEMORY.TRANSLATED.NET/DOC/USAGELIMITS.PHP TO TRANSLATE MORE
464,kata paling menjentidakelkan skr dukung paslon 2 3 amin yuk retweet banyak banyak anies cak imin presiden insayaaallah amin,MYMEMORY WARNING: YOU USED ALL AVAILABLE FREE TRANSLATIONS FOR TODAY. NEXT AVAILABLE IN  04 HOURS 42 MINUTES 56 SECONDS VISIT HTTPS://MYMEMORY.TRANSLATED.NET/DOC/USAGELIMITS.PHP TO TRANSLATE MORE
465,banding tunjuk anies baswedan lebih fokus implementasi bijak dampak positif utama kait sejahtera masayaarakat,MYMEMORY WARNING: YOU USED ALL AVAILABLE FREE TRANSLATIONS FOR TODAY. NEXT AVAILABLE IN  04 HOURS 42 MINUTES 54 SECONDS VISIT HTTPS://MYMEMORY.TRANSLATED.NET/DOC/USAGELIMITS.PHP TO TRANSLATE MORE
466,anies baswedan calon presiden harap jauh arogansi pimpin jalan nilainilai pegang corruption watch,MYMEMORY WARNING: YOU USED ALL AVAILABLE FREE TRANSLATIONS FOR TODAY. NEXT AVAILABLE IN  04 HOURS 42 MINUTES 52 SECONDS VISIT HTTPS://MYMEMORY.TRANSLATED.NET/DOC/USAGELIMITS.PHP TO TRANSLATE MORE
467,corruption watch sorot anies baswedan lebih cenderung solusi sekadar salah gagal proyek cipta harap positif masa depan,MYMEMORY WARNING: YOU USED ALL AVAILABLE FREE TRANSLATIONS FOR TODAY. NEXT AVAILABLE IN  04 HOURS 42 MINUTES 51 SECONDS VISIT HTTPS://MYMEMORY.TRANSLATED.NET/DOC/USAGELIMITS.PHP TO TRANSLATE MORE
468,anies baswedan pimpin mampu pimpin bijak beri solusi nyata masalah kompleks,MYMEMORY WARNING: YOU USED ALL AVAILABLE FREE TRANSLATIONS FOR TODAY. NEXT AVAILABLE IN  04 HOURS 42 MINUTES 49 SECONDS VISIT HTTPS://MYMEMORY.TRANSLATED.NET/DOC/USAGELIMITS.PHP TO TRANSLATE MORE
469,luar biasa anies,MYMEMORY WARNING: YOU USED ALL AVAILABLE FREE TRANSLATIONS FOR TODAY. NEXT AVAILABLE IN  04 HOURS 42 MINUTES 47 SECONDS VISIT HTTPS://MYMEMORY.TRANSLATED.NET/DOC/USAGELIMITS.PHP TO TRANSLATE MORE
470,damai cegah pecah akibat pilpres 20142019 skrg dukung anies cipta pecah baru dg nyerang salah satu soal gila jabat,MYMEMORY WARNING: YOU USED ALL AVAILABLE FREE TRANSLATIONS FOR TODAY. NEXT AVAILABLE IN  04 HOURS 42 MINUTES 45 SECONDS VISIT HTTPS://MYMEMORY.TRANSLATED.NET/DOC/USAGELIMITS.PHP TO TRANSLATE MORE
471,duuh sorryangua bkn kalian gua bkn tipe jilat bebek qiyadah harus cebokin penting atas lawan logika nurani sendiri,MYMEMORY WARNING: YOU USED ALL AVAILABLE FREE TRANSLATIONS FOR TODAY. NEXT AVAILABLE IN  04 HOURS 42 MINUTES 43 SECONDS VISIT HTTPS://MYMEMORY.TRANSLATED.NET/DOC/USAGELIMITS.PHP TO TRANSLATE MORE
472,jaman purba sampe sekarang hukum indo kek kata anies debat capres kemaren kek bakal sampe 100tahun depan walaupun konteks bukan soal jabat rakyat biasa inti hukum indonesia kek tai,MYMEMORY WARNING: YOU USED ALL AVAILABLE FREE TRANSLATIONS FOR TODAY. NEXT AVAILABLE IN  04 HOURS 42 MINUTES 42 SECONDS VISIT HTTPS://MYMEMORY.TRANSLATED.NET/DOC/USAGELIMITS.PHP TO TRANSLATE MORE
473,anies baswedan calon presiden harap jawab kritik beli pesawat tempur alokasi anggar butuh masayaarakat,MYMEMORY WARNING: YOU USED ALL AVAILABLE FREE TRANSLATIONS FOR TODAY. NEXT AVAILABLE IN  04 HOURS 42 MINUTES 40 SECONDS VISIT HTTPS://MYMEMORY.TRANSLATED.NET/DOC/USAGELIMITS.PHP TO TRANSLATE MORE
474,2019 pilih jokowi kamua 2024 kok pilih pak anies umur hidup ikut milu pernah pilih,MYMEMORY WARNING: YOU USED ALL AVAILABLE FREE TRANSLATIONS FOR TODAY. NEXT AVAILABLE IN  04 HOURS 42 MINUTES 39 SECONDS VISIT HTTPS://MYMEMORY.TRANSLATED.NET/DOC/USAGELIMITS.PHP TO TRANSLATE MORE
475,mayoritas pilih anies muslim taat wsajar kalau minta fatwa ulama rujuk beda dengan mayoritas nya pilih nya kaum kepet sunat bujerbujer sampah pecah belah,MYMEMORY WARNING: YOU USED ALL AVAILABLE FREE TRANSLATIONS FOR TODAY. NEXT AVAILABLE IN  04 HOURS 42 MINUTES 37 SECONDS VISIT HTTPS://MYMEMORY.TRANSLATED.NET/DOC/USAGELIMITS.PHP TO TRANSLATE MORE
476,bahkan sandi uno bilang kalau hadir anies undah anugerah buat sandi uno elektabilitas cman 07 sanding dg anies nama jadi kenal lebih luas,MYMEMORY WARNING: YOU USED ALL AVAILABLE FREE TRANSLATIONS FOR TODAY. NEXT AVAILABLE IN  04 HOURS 42 MINUTES 35 SECONDS VISIT HTTPS://MYMEMORY.TRANSLATED.NET/DOC/USAGELIMITS.PHP TO TRANSLATE MORE
477,anies klo mau menang aku dulu gol muntari,MYMEMORY WARNING: YOU USED ALL AVAILABLE FREE TRANSLATIONS FOR TODAY. NEXT AVAILABLE IN  04 HOURS 42 MINUTES 34 SECONDS VISIT HTTPS://MYMEMORY.TRANSLATED.NET/DOC/USAGELIMITS.PHP TO TRANSLATE MORE
478,siasia anggar 80 t bawa anies sama angin jadi gubernur gagal maksa nyapres gaco selamat pagi anies gempa surabaya olivia pilih baik molly,MYMEMORY WARNING: YOU USED ALL AVAILABLE FREE TRANSLATIONS FOR TODAY. NEXT AVAILABLE IN  04 HOURS 42 MINUTES 32 SECONDS VISIT HTTPS://MYMEMORY.TRANSLATED.NET/DOC/USAGELIMITS.PHP TO TRANSLATE MORE
479,saya putus sama orang2 dulu paham saya tuju sama ubah lalu orang nama anies baswedan,MYMEMORY WARNING: YOU USED ALL AVAILABLE FREE TRANSLATIONS FOR TODAY. NEXT AVAILABLE IN  04 HOURS 42 MINUTES 31 SECONDS VISIT HTTPS://MYMEMORY.TRANSLATED.NET/DOC/USAGELIMITS.PHP TO TRANSLATE MORE
480,bilang edit pernah tonton debat molor sedang ngecak judi bola otak duit akun akun x kena sogok 02 bela sekalipun bohong mesti laku,MYMEMORY WARNING: YOU USED ALL AVAILABLE FREE TRANSLATIONS FOR TODAY. NEXT AVAILABLE IN  04 HOURS 42 MINUTES 29 SECONDS VISIT HTTPS://MYMEMORY.TRANSLATED.NET/DOC/USAGELIMITS.PHP TO TRANSLATE MORE
481,maaf aku gak liat tiktok liat wawancara pak anies tahun 2018 kumpar liat di youtube kumpar official teriterima kasih,MYMEMORY WARNING: YOU USED ALL AVAILABLE FREE TRANSLATIONS FOR TODAY. NEXT AVAILABLE IN  04 HOURS 42 MINUTES 27 SECONDS VISIT HTTPS://MYMEMORY.TRANSLATED.NET/DOC/USAGELIMITS.PHP TO TRANSLATE MORE
482,orang punya tahu kan erti jawab pak anies bangun ikn saat tidak lah lebih penting bangun sekolah 2 rusak transfortasi rakyat baik sektor ekonomi tengah ekonomi indonesia stabil,MYMEMORY WARNING: YOU USED ALL AVAILABLE FREE TRANSLATIONS FOR TODAY. NEXT AVAILABLE IN  04 HOURS 42 MINUTES 26 SECONDS VISIT HTTPS://MYMEMORY.TRANSLATED.NET/DOC/USAGELIMITS.PHP TO TRANSLATE MORE
483,mantap bayar naik sekarang bayar serang anies beri saran anies kalau terlalu serang hasil surveynya nyungsep,MYMEMORY WARNING: YOU USED ALL AVAILABLE FREE TRANSLATIONS FOR TODAY. NEXT AVAILABLE IN  04 HOURS 42 MINUTES 24 SECONDS VISIT HTTPS://MYMEMORY.TRANSLATED.NET/DOC/USAGELIMITS.PHP TO TRANSLATE MORE
484,pks bilang anies baswedan utang jasa warga jakarta bukan,MYMEMORY WARNING: YOU USED ALL AVAILABLE FREE TRANSLATIONS FOR TODAY. NEXT AVAILABLE IN  04 HOURS 42 MINUTES 23 SECONDS VISIT HTTPS://MYMEMORY.TRANSLATED.NET/DOC/USAGELIMITS.PHP TO TRANSLATE MORE
