,full_text,tweet_english
116,jelas tak level laaah mbak pak anies tuuuh capres sedantidakan bang fahri cuman juru bicara kl buat tweet tuuuh pak baru tuuuh level pak aniessama2 capres cerdas dikit berhusnudzon napa siih mbak kata nya pilpres gembiralupa yaa gemoy,clearly not level laaah mbak pak anies tuuuh capres sedantidakan bang fahri cuman kl spokesman for tweet tuuuh pak baru tuuuh level pak aniessama2 little intelligent capres napa siih nudzon mbak kata nya pilpres gembiralupa yaa gemoy
117,anies antidakuh tega hukum padahal para dukung masalah berani tego gaco olivia jill biden daesang gempa adidas surabaya batter up 100m views pilih baik melania bangtan debut,anies antidakuh tega hukum even though the supporters support the problem of dare tego gaco olivia jill biden daesang earthquake adidas surabaya batter up 100m views choose either melania bangtan debut
118,mmmmkayaknya ngga yakin sama kualitas capres dukung butuh bawa2 nama orang delusi anda lebih baik anies wake up saudara ikhlas hati baik indonesia seluruh biar baik yang pilih,"mmmm, I don't think I'm sure the quality of the presidential candidate support needs to bring the name of your delusional people better anies wake up brother sincerely good heart Indonesia all around so it's good to choose"
119,anies sosok capres tidak milik adab orang lebih tua gaco olivia jill biden daesang gempa adidas surabaya batter up 100m views pilih baik melania bangtan debut,anies figure of the presidential candidate does not belong to the manners of older people gaco olivia jill biden daesang earthquake adidas surabaya batter up 100m views choose well melania bangtan debut
120,macam serang anies lalu anies nampol balik woiii,like attack anies then anies nampol back woiii
121,jadi anggota mrk yang bunuh kan 6 orang udah bunuh ga dapet jabat anies ga nolong klo mrk mau nyoblos dukung cm hak warga negara mau golput hak mrk lama mrk bukan genocide supporters or genocide actors gak kasih jabat mrk ga bsa buat ap2,being a member of MRK who killed 6 people already killed ga dapet jabat anies ga nolong klo mrk want nyoblos support cm citizen rights want golput rights mrk lama mrk not genocide supporters or genocide actors do not love jabat mrk ga bsa for ap2
122,anies selalu jebak asumsi pribadi ada dukung bukti fakta gaco olivia jill biden daesang gempa adidas surabaya batter up 100m views pilih baik melania bangtan debut,anies always trap personal assumptions there is evidence supporting facts gaco olivia jill biden daesang earthquake adidas surabaya batter up 100m views choose well melania bangtan debut
123,ga yang peduli org2 kamu50 puja riziq soal ga usah turun suara anies org2 kaya riziq ikut,no one cares about your org250 puja riziq about not having to go down anies voice org2 rich in riziq come along
124,jugan suuzon bang orang paling ikhlas pak gak muntidakin main cara2 kotor itu pak ikhlas kalau tidak pilih pak ikhlas klo anies pilih tapi kok aku percaya 99 sama statemt abang,also suuzon bang the most sincere person sir not muntidakin playing dirty ways sir sincere if you don't choose sir sincere klo anies choose but why do I believe 99 is the same statemt brother
125,sukasuka orang lah mau milih anies kaga lucu banget dukung anies tukang guilttrip orang liat noh swing voters belum mau ngevote anies awokwok,sukasuka orang lah mau milih anies kaga really funny support anies tukang guilttrip orang liat noh swing voter tidak mau ngevote anies awokwok
126,anies lihat munafik kait sikap lanjut ikn gaco olivia jill biden daesang gempa adidas surabaya batter up 100m views pilih baik melania bangtan debut,anies look hypocritical hook attitude further ikn gaco olivia jill biden daesang earthquake adidas surabaya batter up 100m views choose well melania bangtan debut
127,anies sama jadi seolah2 kerja sama padahal ngalir itu,anies is the same as if it were cooperation even though it flows
128,moga anies menang amin aamiin amin gaes,let's hope anies wins amen aamiin amen gaes
129,agama islam mengsajarkan untuk bakti dua orang tua dinding adidas karina surabaya anies daesang gempa islam,islamic religion aligns for the devotion of two parents adidas wall karina surabaya anies daesang earthquake islamic
130,akhir anies kena batu ucap kait udara ber ktapi gaco olivia jill biden daesang gempa adidas surabaya batter up 100m views pilih baik melania bangtan debut,end anies hit a rock say air hook ber ktapi gaco olivia jill biden daesang earthquake adidas surabaya batter up 100m views choose well melania bangtan debut
131,celana panjang chino pria murah kualitas dapat cashback 40 shopee video anies gaco daesang surabaya gempa ayo lihat video shopee video,men's chino trousers cheap quality can cashback 40 shopee video anies gaco daesang surabaya earthquake let's see video shopee video
132,jelas lebih pantes anies,clearly more pantes anies
133,serang yang kerja si memed hari buzzer ayah semua medsos debat kpu serang kalap sekali rl nyata ada hasil cenderung negatif anies pelan2 banyak bicara semua kalangantitik cerah,attack that work memed day buzzer dad all medsos debate kpu attack once real rl there are results tend to be negative anies slowly talk a lot all bright kalangantitik
134,panggung debat panggung ny sama anies klo kalah panggung langsung ulti nya pake surat lah lah lah nyari kunci pokok hahahahaaa badut politik,stage debate stage ny sama anies klo lose stage directly ultinya use letter lah lah nyari key staple hahahahaaa political clown
135,tinggal dukung anies baswedan lebih mampu ayom rakyat indonesia depan,just support anies baswedan more able to ayom the people of Indonesia
136,singgung soal janji tak maju ada pilpres anies komitmen dki,allude to the promise of no progress there is a presidential election anies dki commitment
137,anies memang gak percaya kata2 nya tukang obral janji,"anies did not believe his words, the salesman promised"
138,parah banget cantik udah gitu keren dukung pak anies sempurna,"it's so beautiful, it's so cool to support Mr. Anies perfectly"
139,haha janji apa batas hak orang untuk abdi negara emang jamin hak hidup anies baswedan sedih sekali kualitas pikir makin turun,"haha promise what is the limit of people's rights for servants of the country, guarantee the right to life anies baswedan sadly the quality of thought is getting down"
140,fans bole otak pakai nyata jadi hoax hoax kalian buat jd nyata nonton bnyk,fans bole brains use real so hoax hoax you make jd real watch bnyk
141,main aman gimana jauh pikir awam itu jelas banget kok sikap anies ttg ikn apa lo doang ga faham,playing peacefully how far the public mind is clear how come the attitude of anies about what ikn lo doang don't understand
142,ayoviralkan rekam jejak anies rasayaid baswedan pimpin dki jkt,ayoviralkan track record anies rasayaid baswedan pimpin dki jkt
143,nama gerinda naik pdhl lebih 10th lalu pasang mega seolaholah gerindaria lebih kecil anies njirrtt,the name of the grinder goes up pdhl over 10th then installs mega as if the smaller grinder anies njirrtt
144,betulcocok jadi bapak bangsa king maker gak cocok jadi presidenpresiden biar cocok2 sajaanies,properly fit to be the father of the king maker nation is not suitable to be the president so that it matches the sajaanies
145,hatihatianies dekat abdsomad,hatihatianies near abdsomad
146,anies cerdas amp jujur fakta,anies intelligent & honest facts
147,pada takut sama fpi dah organisasi udah bubar kok takut sama ideologi emang power besar apa pas anies jabat jadi gub dki ngadain christmas carol gitu mantan pentol fpi rusuh aduh,in fear of the same fpi already the organization has disbanded why are you afraid of the same ideology emang great power what fits anies jabat so gub dki ngadain christmas carol so ex pentol fpi riot ouch
148,ampun ama ni orang benci fpi dan gerombol nya kena anies dulu kena tuduh mobilisasi 212 keluarga cikeas eh pangeran cikeas kalah putar pertama kena anies,sorry ama this people hate fpi and the horde got anies first got accused of mobilizing 212 families cikeas eh prince cikeas lost the first round of getting anies
149,lama tuan timbul hidup anies gausah nyapres gitu etika gak bicara2 soal etika kaya tuan plongo lebih fahan sudah menang 2x tuan timbul,old sir arise live anies gausah nyapres gitu ethic not talking about ethics rich sir plongo more fahan has won 2x sir arise
150,mentidakaitkan apbd dki puluh trilyun mampu anies atas polusi padahal masalah polusi jkt bukan soal duit tentang wenang perintah pusat stupid soal lintidakungan yang harus koreksi,disassociate apbd dki tens of trillions able to anies over pollution even though the problem of JKT pollution is not a matter of money about the authority of the stupid central order about lintidakungan that must be corrected
151,anies lbh baik dibandintidakan kamu hya dewan jilat amp munafik,anies lbh well dibandintidakan you hya hall lick amp hypocrite
152,hukum tegak semua capres anies singgung gibran papar visi misi soal tega hukum,"the law upholds all presidential candidates, anies alludes to gibran, explains the vision and mission of the law"
153,lamongan viva jatim naskah uji kelas xi samak muhammadiyah sekar kabupaten lamongan pampang foto calon presiden capres anis baswedan naskah uji mata pelsajaran bahasa inggris dapat foto anies baswedan sebut dapat poin b nomer 21 23,lamongan viva jatim test script class xi samak muhammadiyah sekar lamongan pampang regency presidential candidate photo anis baswedan test script English language teaching can photo anies baswedan say can point b number 21 23
154,ini 13 poin pakta integritas pakat paslon 1 anies baswedan muhaimin iskandar dapat dukung ijtima ulama sepenuh,this 13 points pact integrity pakat paslon 1 anies baswedan muhaimin iskandar can support ijtima ulama full
155,saha ieu teh meuni geulis kitu sampai salam si cantik dan kasih tahu bahwasanya akan pilih pak anies jadi presiden ri,saha ieu teh meuni geulis kitu until greeting the beautiful and tell him that he will choose pak anies to be president ri
156,desak anies desak nya bukan asal nama biar tarik acara orang beneran ngedesak keras depan muka pak anies,urging anies the urging is not the origin of the name so pull the event people really pressed hard in front of Pak Anies face
157,kasi mau pilih anies dibully emak,i want to choose my mother's bullied anies
158,kutip anies dasar atas berita 2019 prioritas bangun pedestrian cak imin beliau bicara ketidaksepakatannya atas pindah ibukota justru teguh stereotipe kalimantan,cite basic anies on the news of 2019 the priority of building a pedestrian is imin he spoke his disagreement over moving the capital is actually firmly the stereotype of Kalimantan
159,2 hari lalu anies tetap trending twitterx tanya,2 days ago anies still trending twitterx asked
160,gilir mas anies ngegas,queue mas anies ngegas
161,anies musuh negara wakanda harap rakyat indonesia wakanda no more indonesia forever,anies enemy of the state of wakanda hope that the people of Indonesia wakanda no more indonesia forever
162,anies ga tolak memang gera karena jokowi literally ga yang berani larang karena memang massa sedang gusar jelas anies bukan inisiator dalang ga nge encourage ga libat jadi sama sekali,anies ga reject is indeed gera because jokowi literally ga who dares to ban it because the masses are angry it is clear that anies is not the initiator of the mastermind ga nge encourage it not to be involved at all
163,pak pernah usung anies tapi untidakit d debat terus bakas pak anies salah ingat gerindaria terima banyak manfaat saaat dukung anies,sir never stretch anies but foridakit debate continue bakas pak anies wrong remember gerindaria receive many benefits saaat support anies
164,pak anies tugas nya pak surya lantas tak level tuh jongos nya yaaa mbak,sir anies his duty pak surya then not the level tuh jongos nya yaaa mbak
165,nilai sangat santai sangat tenang tak lihat gugup sama sekali bahkan beberapa kali justru hasil cair suasana jokesnya gaya silat gemoy pasca jawab tanya anies lalu ikut riuh tawa tonton pimpin tegas,value is very relaxed very calm do not look nervous at all even a few times it is actually the result of the joking atmosphere of the gemoy silat style after answering questions anies then participating in noisy laughter watch pimpin tegas
166,begini mentah dam sifat capres anies sombong antidakuh,this is raw and the nature of presumptuous anies presumptuous
167,anies menang pilkada habib rizieq ga minta apa gsajadi apa,anies won the election habib rizieq don't ask what gsajadi what
168,anies baswedan tuding capres banyak janji timnas amin janji ukur,"anies baswedan pointed the finger at the presidential candidate, many promises from the national team, amen promise to measure"
169,mereka2 alergi fpi jakarta jadi neraka jaman pak anies shummum bukamuun umyun fa hum l yarjin,they are allergic to fpi jakarta so hell time pak anies shummum bukamuun umyun fa hum l yarjin
170,anies baswedan cerita ustad abdul somad heran ada doa debat capres,anies baswedan story ustad abdul somad wonder there is a presidential debate prayer
171,temen ngoceh soal debat pilpres jd dengar baik dech y bagus kata pak anies d harap guna data spya gen z kosong jd faham visi misi pak anies,temen ngoceh about the presidential election debate jd hear good dech y good said pak anies d hope to use data spya gen z blank jd understand the vision and mission of pak anies
172,nasdem aju anies nasdem ini pasang rekonsiliasi bangsa negara pascaketerbelahan milu 2019 bukan versi fahri hamzah ngarang pak lurah neng ae bulan tunggu tak respons malah ab hendak kriminalisasi,nasdem aju anies nasdem this install the reconciliation of the nation after the split of milu 2019 is not the version of fahri hamzah ngarang pak lurah neng ae bulan wait not to respond even ab wants to criminalize
173,harus mas anies briefing dulu ngomong isu demokrasi kait oposaudarii partai usung utama nasdem pkb ibarat dulang air ciprat muka sendiri,must mas anies briefing first talking about the issue of democracy hook oposaudarii main stretching party nasdem pkb like a tray of water splints own face
174,pantesan kalau polling x anies menang mulucocok jadi presiden medsos doangnegeri maya,pantesan if poll x anies win mulucocok become president of doangnegeri virtual social media
175,bang andarie tidak etika antidakuh klaim anies jadi gub dki gerindaria tapi jasa jasa partai relawan2 rakyat dki yakin kalau gerindaria ssaja sendiri ngusung anies gak jadi,bang andarie is not ethical antidakuh anies claim to be gub dki gerindaria but the services of the people's volunteer party dki are sure that gerindaria ssaja itself carries anies not so
176,anies tunjuk ada tega hukum mata orang tua korban cari adil saat ini,anies points out that there is a law against the eyes of the victim's parents looking for justice at this time
177,mustahil saudara nu pkb mau dikemanain anies masa jabat semua agama tara fpi diem ga aneh beras bansos jadi bancak anak buah pak heru cium kalau anies kasih dana lebih fpi tahu viral lah,impossible brother nu pkb want to be accompanied by anies the tenure of all religions tara fpi diem ga bizarre rice bansos so bancak sir heru's men kiss if anies give more funds fpi know viral lah
178,koq kamu sesal nyata anies nus laku nya lah ga tahan tolol,koq you regret real anies nus behavior is it can't stand stupid
179,kyk anies udah ngegolin anulir offset,kyk anies already mengegolin anulir offset
180,2x periksa kpk anies datang 2x tidak bukti,2x check kpk anies come 2x no proof
181,bayang gak kalau tiba2 orang banyak pilih anies lalu menang pas menang baru tau kelompok sama ormas2 tsb apa rasa mereka2 tipu 2 kali tsb,"shadow or not if suddenly many people choose anies and then win when they win, they just know the group with the mass organizations, what do they think they cheated 2 times?"
182,berani terobos area tega hukum paling rawan debat capres reza indariagiri siapa kapolri anies,dare to break through the most vulnerable legal Tega area of the presidential debate reza indariagiri who is Kapolri Anies
183,wkwkw iya kemarin2 kan efpei 212 beritane condong beberapa tokoh intine babe haekal neno warisamaan fahri hamzah eh gilir tokoh2 lain anies baswedan lsg cap politik identitas,wkwkw yes yesterday2 efpei 212 beritane incline some figures intine babe haekal neno inheritance fahri hamzah eh turn other figures anies baswedan lsg stamp political identity
184,mana hebat wowo gertak si owe ciut dah aneh wsajah perisai nya awokwoox,where's the great wowo bluff the squeaky owl is weird wsajah his shield awokwoox
185,pantes buzzerrp om wowo aktif bngt nyerang anies segala penjurutaunya nutupin om wowo ko cape diri wkt debat kamurn segala cara nyerang anies ga mempan akhir tau om wowo lagi kurang sehat sehat sehat om wowo msh debat lain,pantes buzzerrp om wowo active bngt nyerang anies all the sequencers nutupin om wowo ko cape themselves wkt debate kamurn all the ways nyerang anies ga mempan akhir tau om wowo lagi less healthy healthy om wowo msh another debate
186,kalau nyerang anies debat soal politik identitas aku sukarela bakal jadi buzzer,if you attack anies debate about identity politics I will volunteer to be a buzzer
187,siap debat dua amin misi sejahtera keluarga akar kuat bangsa jcc network anies pilih baik,ready to debate two amen mission prosperous family strong roots of the nation jcc network anies choose well
188,tahu uas ulama ulama simpat anies beberapa bulan lalu sempat aku lihat video uah dukung anies jadi perlu heran pilih bebas ssaja ulama banyak masing masing punya pilih beda beda,know uas ulama ulama simpat anies a few months ago I saw a video uah support anies so I need to be surprised to choose freely only many ulama each have different choices
189,adem liat nya klo anies ngomong,adem liat nya klo anies ngomong
190,1 anies muhaimin 27 2 gibran 93 3 mahfud 43,1 anies muhaimin 27 2 gibran 93 3 mahfud 43
191,capres no urut 1 anies baswedan hadir diskusi sama kelompok disabilitas se jabodetabek islamic center kota bekas jabar jumat 1512 hub,presidential candidate no. 1 anies baswedan attended a discussion with the disability group as jabodetabek islamic center in the former West Java city on Friday 1512 hub
192,harus bukan judul gerinda bantah ucap kan anies kutip nyata bahkan vidio kita lihat sekarang banyak edar,must not be the title of the gerinda bantah say anies quote real even vidio we see now a lot of circulation
193,dulu milih fpi dulu milih jokowi yang jokowi yang pdip yang dulu milih fpi sekarang gabung anies yang dulu milih jokowi pdip sekarang gabung saudarianya gabung,used to vote for fpi used to vote for jokowi who was jokowi who was pdip who used to vote for fpi now join anies who used to vote for jokowi pdip now join his sister join
194,anies baswedan klarifikasi janji tak nyapres lawan singgung soal komitmen,anies baswedan clarification of the promise of tak nyapres opponent alludes to the commitment
195,siapa pilih bagai presiden 2024 anies muhaimin 900 gibran 61 mahfud 38 total suara 1302 klik link forward group temantemanmu terima kasih,who chooses like the president 2024 anies muhaimin 900 gibran 61 mahfud 38 total votes 1302 click the link forward group your friend thank you
196,anies libat putus bangun ikn beliau tau alas jelas harus segera bangun masalah masih banyak jadi saya malah lebih bijak anies jawab atau ketika tanya soal ikn,anies is involved in breaking up the wake up of ikn he knows the base clearly must immediately wake up the problem is still a lot so I am even wiser anies answer or when asking questions ikn
197,ahok ngebacot kep ribu tahun 2016 212 ngumpul dimonas 2016 kena anies,ahok ngebacot kep ribu tahun 2016 212 ngumpul dimonas 2016 kena anies
198,anies antidakuh tega hukum padahal para dukung masalah berani tego gaco selamat pagi batter up 100m views gempa anies kamis daesang pilih baik adidas moldova ulama dana ginting bengis,anies antidakuh tega hukum even though the supporters support the problem of dare tego gaco good morning batter up 100m views anies earthquake Thursday daesang choose well adidas moldova ulama dana ginting bengis
199,dukung telah hasil debat kamurin akan dukung anies,support has been the results of the kamurin debate will support anies
200,anies baswedan tuding capres banyak janji timnas amin janji ukur,"anies baswedan pointed the finger at the presidential candidate, many promises from the national team, amen promise to measure"
201,kalau dibaca2 baik tetep putus tangan presiden aku percaya pak anies bakal laku rugi masayarakat golong tentu tidak bukti jkt di jkt dia dukung minoritas buat yang lain emosi tolak adem adil,"if it is read well, it still breaks the president's hand, I believe Pak Anies will be a loser for the golong community, of course, there is no evidence that JKT in JKT, he supports minorities for others, emotions refuse to be fair"
202,kelen gorenggoreng sampah mending tanya pak aksa mahmud sampai nama pak anies muncul pilagiub dki,kelen gorenggoreng sampah mending tanya pak aksa mahmud until the name pak anies appeared pilagiub dki
203,anies sosok capres tidak milik adab orang lebih tua gaco selamat pagi batter up 100m views gempa anies kamis daesang pilih baik adidas moldova ulama dana ginting bengis,anies figure of the presidential candidate does not belong to the manners of older people gaco good morning batter up 100m views anies earthquake Thursday daesang choose well adidas moldova ulama dana ginting bengis
204,klu gak punya ambisi nama nya mayat anies podo wae,klu has no ambition his name is anies podo wae corpse
205,kemarin topik anies terus saudara takut yah,yesterday the topic of anies kept you scared
206,gak sadar anies calon pks sandiaga calon gerindaria kocak,unknowingly anies candidate pks passwordaga candidate gerindaria hilarious
207,anies selalu jebak asumsi pribadi ada dukung bukti fakta gaco selamat pagi batter up 100m views gempa anies kamis daesang pilih baik adidas moldova ulama dana ginting bengis,anies always trap personal assumptions there is supporting evidence of the fact gaco good morning batter up 100m views anies earthquake Thursday daesang choose well adidas moldova cleric dana ginting ruthless
208,lalu pilih sandi uno sekarang tugas selesai balik teman lama utl hadap orang usung waktu anies tinggal kwn lama 5 tahun caci maki kerja luar biasa,then choose a uno password now the task is done behind an old friend utl against a stretcher when anies stayed kwn a long time 5 years insulting extraordinary work
209,baru tahu insiden sekian tahun hasil diumpetin publik eh sekarang buka sama anies pantes sj berang,just found out about the incident over the years the results of public decoction eh now open the same anies pantes sj beaver
210,anies lihat munafik kait sikap lanjut ikn gaco selamat pagi batter up 100m views gempa anies kamis daesang pilih baik adidas moldova ulama dana ginting bengis,anies see hypocrisy hook attitude further ikn gaco good morning batter up 100m views earthquake anies Thursday daesang choose well adidas moldova ulama dana ginting bengis
211,makanya kan aneh papar anies kan jelas indeks demokrasi turun bebas dapat kekang eh tiba2 yang bilang diktator menguntidakit jasa2nya anies kan aneh jaka sembung bawa golok,"that's why it's strange to see anies, it's clear that the free democracy index can be bridled, eh, all of a sudden who says that the dictator stalked his services, anies, it's weird, jaka sembung, bring a machete"
212,kalau pak dukung habib luthfi babeh haikal engga politik identitas sedantidakan pak anies dukung sama uas malah bilang politik identitas bukan semua sama ya mainin politik identitas kalau gt masuk pak muncul adzan maghrib rcti,if sir supports habib luthfi babeh haikal not identity politics sedantidakan pak anies support same uas instead say identity politics is not all the same yes playin identity politics if gt enter sir appear adzan maghrib rcti
213,banyak bacot udah langgar etika konstitusi gak etika debat malah bilang anies gak etika rela bodoh asam sulfat badut,many bacot have violated the ethics of the constitution or not the ethics of the debate even saying anies or not the ethics are willing to be stupid sulfuric acid clowns
214,akhir anies kena batu ucap kait udara ber ktapi gaco selamat pagi batter up 100m views gempa anies kamis daesang pilih baik adidas moldova ulama dana ginting bengis,end of anies hit by stone say air hook with ktapi gaco good morning batter up 100m views anies earthquake Thursday daesang choose well adidas moldova ulama dana ginting bengis
215,berani terobos area tega hukum paling rawan debat capres reza indariagiri siapa kapolri anies,dare to break through the most vulnerable legal Tega area of the presidential debate reza indariagiri who is Kapolri Anies
216,anies keok daesang adidas singapura,anies keok daesang adidas singapore
217,fitnah apa fakta ayo jugan d bolak balik apa d sampek pak anies fakta benar coba buntu letak fitnah buntu ga data,slander what are the facts let's also go back and forth what d arrive pak anies true facts try dead end put slander dead end ga data
218,kisah michael hart pria yahudi amerika protes tentang umum nama nabi muhammad kuliah umum london selamat pagi anies ulama gaco adidas ordal semalem uncrush koda daesang,story of michael hart american jewish man protest about the general name of the prophet muhammad public lecture london good morning anies gaco cleric adidas ordal semalem uncrush koda daesang
219,info slot gacor hari link slot gacor olivia anies prime video daesang karina dana mahito molly islam angin dieng,info slot gacor hari link slot gacor olivia anies prime video daesang karina dana mahito molly islam wind dieng
220,liat rekam jejak pas jd gubernur sajasebutin dapet apa pak anies,see the track record of pas jd governor sajasebutin dapet apa pak anies
