,full_text,tweet_english
221,manteb emang menteri baru klo lama kan korupsi kader nasdem skarenag dukung anies,manteb emang new minister klo lama kan corruption cadre nasdem skarenag support anies
222,selamat pagi jumat 15 desember 2023 pak anies sama disabilitaspada hari para disabilitas sejabodetabek gauntidakan anies presiden 2024 islamic center kota bekas,good morning friday 15 december 2023 pak anies sama disability on the day of the disabled as soon as gauntidakan anies president 2024 islamic center used city
223,analisaudari linguistik ekspresi gaya bicara anies debat perdana,analysis of linguistic expressions of speech style anies preliminary debate
224,narasi sesat pas anies jadi gub jakarta emang dki jd ibukota sayaariah islam justru kota ramah seluruh peluk agama ga pelihara benci lihat rekam jejak prestasi amp sumbangsih pak anies jugan tipu narasi islamophobia mcm,heretical narrative pas anies so gub jakarta emang dki jd capital meariah islam in fact a friendly city all over the world embracing religion do not maintain hate see the track record of performance & contribution sir anies jugan lie narrative islamophobia mcm
225,lagi anis ko bukan anies awokwokwokwok,again anis ko not anies awokwokwokwok
226,sajaib mereka paling keras tolak rizieq asosiasi anies yang biasa paling lantang citra progresip peduli bebas ekspres demokrasi ham hak minoritas lha kamu mau serius bicara hak minoritas enak tolak hak orang,magic they are the loudest reject rizieq the usual anies association the loudest progressive image care freely express democracy human rights minority rights lha you want to seriously talk about minority rights tasty reject people's rights
227,ab respons umum rakernas nasdem dengan apresiasi baik gp tetap diam teuku umar dingindingin ssaja gondangdia tawar anies ke pak lurah pak lurah janji jawab beberapa waktu kemudian kalau tak salah bulan bulan,ab general response rakernas nasdem with good appreciation gp remained silent teuku umar dingindingin ssaja gondangdia bargained anies to pak lurah pak lurah promise to answer some time later if it's not wrong month month
228,cek link bio tag olivia daesang gaco batter up 100m views gempa surabaya anies dana 40 hari first lady pilih baik,check link bio tag olivia daesang gaco batter up 100m views earthquake surabaya anies fund 40 days first lady choose well
229,bener2 jadi akun bayar sekarang haha toloool,bener2 so account pay now haha toloool
230,makin dekat pilpres makin banyak dukung pasang amin anies baswedan sosok tepat jadi orang presiden cerdas tegas jujur berani wibawa tanggungjawab rakyat kalau gak sekarang kapan punya presiden pak anies,"the closer the presidential election, the more support the pair of amen anies baswedan the right figure so that the president is smart, firm, honest, and courageous, the responsibility of the people if not now when have the president, Pak Anies"
231,tinggal si anies mau jalan fakta integritas 2 poin sebut tidak semua tang anies caprescabut undangundang atau tetap jalan,stay the anies want to walk the integrity fact 2 points say not all tang anies caprescabut laws or keep walking
232,laku untuk nilai kubu dn anies bagi mana visamais mrk scr legitimate bs kt sandintidakan nazisamae apartheid dn islamisamae ala isaudari satu kalimat,behavior for the value of fort dn anies for which the visamais mrk scr legitimate bs kt sandintidakan nazisamae apartheid dn islamisamae ala isaudari one sentence
233,dulu mas anti abud anies jago sama2 nyungsep sekarang muji2 wan abud duh,mas anti abud anies jago sama2 nyungsep now muji2 wan abud duh
234,anies keras banget nyata pukul,anies very hard real hit
235,rasa adil timbang ini anies daesang gaco angin ordal karina ginting first lady semalem dieng no 1 no 2 no 3 koda putus selamat pagi aikaedutoys montessori anak pilih main lokal edukasi,sense of fairness weigh this anies daesang gaco wind ordal karina ginting first lady semalem dieng no 1 no 2 no 3 koda break up good morning aikaedutoys montessori children choose to play local education
236,jawab anies kok mutrr muter tong sayaetan,answer anies kok mutrr muter tong akuetan
237,serang masalah oposaudarii debat pertama calon presiden budiman sudjatmiko anies terlalu arogan lancang,attack the issue of oposaudarii the first debate of the presidential candidate sudjatmiko anies is too arrogant
238,kayak pak anies mntidakin hadir bakal muncul tanya balik beliau komisioner dewas kpk soal skandal tidak ada integritas pimpin kpk sendiri,"like Mr. Anies, none of the attendees will appear to ask back, he is the adult commissioner, kpk, about the scandal, there is no integrity, kpk leads himself"
239,siap dulu 2019 skrg yang lbh hebat pa anies baswedan yu amin kan 2024,ready first 2019 now that's great pa anies baswedan yu amen right 2024
240,prediksi togel china pools 15 desember 2023 am 9 7 6 3 0 cb 2d 7 amp 9 top 4d 3017079171039713 top 3d 971397379713139 top 2d 179719371371 shio ayam twins 11,"lottery china pools prediction December 15, 2023 am 9 7 6 3 0 cb 2d 7 amp 9 top 4d 3017079171039713 top 3d 971397379713139 top 2d 179719371371 shio ayam twins 11"
241,kasihan ya pak anies pernah bilang takut tidak punya jabat nyalon tiap milu,"pity, sir, Anies once said that he was afraid of not having a nyalon shake every milu"
242,atas dasar skill beliau sulit tanding maka pak anies sangat cocok kita pilih jubir presiden,"on the basis of his skills, it is difficult to compete, so Mr. Anies is very suitable, we choose the spokesman for the president"
243,tidak milih emang orang tidak milih anies sih,don't choose people don't choose anies anyway
244,laut lo ngak penting masih banyak orang waras dukun anies,sea lo ngak important there are still many sane people shaman anies
245,pakta integritas tanda tangan anies muhaimin insayaaallah dukung bagai kalang terus alir pasang anies muhaimin lolos putar 2 aamiin,pact integrity signature anies muhaimin insayaaallah support like a constant flow tide anies muhaimin escape turn 2 aamiin
246,ngarang anak mas anies mas pernah jadi kepala daerah,ngarang anak mas anies mas was once the regional head
247,kalau anies politik pragmatis turut lihat jauh arti bisa jadi ukur observasi arti umum diskursus intelektual gak laku indonesia pantes kubu sana males debat udahlah jogetin udah parah kondisi bangsa,if anies pragmatic politics also look at the meaning it could be a measure of observation of the general meaning of intellectual discourse not doing well Indonesia pantes camp there males debate already jogetin already bad condition of the nation
248,anies bagai kacang lupa kulit,anies like peanuts forget the skin
249,ini tanda anies lihat diskursus gagas intelektual efektif naik elektabilitasnya akhir guna gaya lama nama politik pragmatis keluar dana besar end goals nya menang mau ordal atau idenpol,this is a sign of anies see the discourse of intellectual ideas effectively increase the electability of the end for the old style of pragmatic political names out of big funds the end goals win want ordal or idenpol
250,pak anies bagus dari awal serang terus kan 3 cawapres nya,"mr. Anies is good from the beginning to attack, right? 3 vice presidents"
251,makamah konstitusi mk kenape masalah mulu capres bowo buka aib anies datengin rumah buat menang pilagiub dki bowo bilang ga nyari jabat terus ngapain capres 4x wkwk pilih baik nomer urut 3,mother of the constitution mk kenape problem mulu presidential candidate bowo open disgrace anies datengin home to win pilagiub dki bowo say ga nyari jabat keep doing presidential candidate 4x wkwk choose good number sequence 3
252,anies gak pernah culik kok tuduh jahat kocak,anies never kidnapped why do you accuse me of being nasty hilarious
253,biasaa semua bakar jenggot sampe takut tengah mati brarti gadukung anies sampe fitnah caci maki ulama astaghfirullah inget azab byk2 istighfar mending,used to all burn the beard until the fear of dying brarti gadukung anies until the slander of insulting the scholar astaghfirullah remembering the punishment byk2 istighfar mending
254,mulai laku 1nt1m1d4si,from 1nt1m1d4si
255,sempat diskus para pemuda jambi milik semangat ubah indonesia diskusi mulai soal didik konflik agraria teknologi aman data hingga bijak bangun akan ambil pilih jadi presiden,"had time to discus the youth of Jambi belonging to the spirit of changing Indonesia, discussions began about the education of agrarian conflicts, data-safe technology, so that wise wake up will choose to be president"
256,anies level ketua demo protes trus ga ngerti mssalah,"anies level leader of the protest demonstration, so I don't understand mssalah"
257,wow ini benar,wow this is true
258,amin doa khusus hari jumat segala hsajat kabul gaco daesang semalem surabaya ordal anies adidas karina koda,amen special prayer friday all hsajat kabul gaco daesang semalem surabaya ordal anies adidas karina coda
259,w45it jangan ikut main,w45it don't play
260,kalau dibaca2 baik tetep putus tangan presiden aku percaya pak anies bakal laku rugi masayarakat golong tentu tidak bukti jkt di jkt dia dukung minoritas buat yang lain emosi tolak adem fakta,"if it is read well, it still breaks the president's hand, I believe Pak Anies will be a loser for the golong community, of course, there is no evidence that JKT in JKT, he supports minorities for others, emotions reject Adem facts"
261,andai partai gabung anies kicau seperti juga sakit hati tinggal,if the party joined the chirping anies as well as the heartache of staying
262,klo mau debat ini panjang akhir lu nyalahin karna lu dukung anies masalah tega hukum semraut saya apresiasi koq nyata anies klo tegak hukum masih kacau arah kan bukan kesana,"if you want this debate to be long, you are guilty because you support anies with the problem of ant law, I appreciate the real koq, anies, klo upright the law is still chaotic, right?"
263,4p4r4t ikut memenantidakan,4p4r4t participated in the victory
264,semenjak ngetwit anies followes gue udah nambah 3000 gimana dong,since tweeting anies followes I've added 3000 how about
265,pilpres 2024 tidak pilih subianto pranowo anies baswedan saya tidak golput bingung tah ora kowe,the 2024 presidential election did not choose subianto pranowo anies baswedan i did not golput confused tah ora kowe
266,anies debat pertama ngomong ngelantur data salah semua,anies the first debate talked about all the wrong data
267,bukan masalah tapi perlu kaji ulang masih perlu atau tidak capres punya skala prioritas nanti pilih apa dulu mana dulu perlu baik ini anies ikn jadi prioritas masih banyak masalah,not a problem but need to review it still need or not presidential candidates have priority scale then choose what to do first where first need to be good this anies ikn be a priority there are still many problems
268,link anti runtidakad olivia daesang gaco batter up 100m views gempa surabaya anies dana 40 hari first lady pilih baik,link anti runtidakad olivia daesang gaco batter up 100m views Surabaya earthquake anies fund 40 days first lady choose well
269,pak anies besar jadi gubernur belimbing sayur besar siapa,pak Anies Besar Becomes the Governor of Belimbing Vegetable Besar
270,komunikasi ab sangat lancar dengan teuku umar selalu kendala misal kena covid bagai diam ssaja tak respons 15 juni 2022 nasdem umum tiga nama calon presiden no 1 anies no 2 andika no 3,ab communication is very smooth with teuku umar always constraints such as being hit by covid like silent just no response 15 june 2022 general nasdem three names of presidential candidates no 1 anies no 2 andika no 3
271,koleksi kendara capres miskin anies baswedan vs capres kaya subianto,a collection of vehicles for poor presidential candidates anies baswedan vs subianto rich presidential candidates
272,mantap sih pak anies jauh membatidakan,steady sir anies far beratidakan
273,kata dukung anies cerdas2,words of support for intelligent anies2
274,karena abud anies mentidaklaim bangun banyak gereja cek fakta kok sara,"because abud anies doesn't claim to build many churches, check the facts, sara"
275,bagai warga jakarta kok malah rasa balik yaanies jelas bawa jakarta jauh lebih baik banding gubernur belum,like citizens of jakarta how come even feel back yaanies obviously bring jakarta much better appeal the governor has not
276,uas klo tahu jejak digital anies waktu wawancara najwa shihabselama pak nyapres tidak nyapresdan terang ortu masalah mati bocil umur 15thn tidak benar mosok sih uas dukung,MYMEMORY WARNING: YOU USED ALL AVAILABLE FREE TRANSLATIONS FOR TODAY. NEXT AVAILABLE IN  04 HOURS 47 MINUTES 58 SECONDS VISIT HTTPS://MYMEMORY.TRANSLATED.NET/DOC/USAGELIMITS.PHP TO TRANSLATE MORE
277,mas daniel mas daniel soal pinang anies jadi gubernur disinggung2 gilir singgung korban nyawa atas kalah mas bowo 2019 kok keluar ucap sampah mau cuci tangan,mas daniel mas daniel about betel anies so the governor was mentioned the death toll for losing mas bowo 2019 why come out saying trash wants to wash their hands
278,mas info dong desak anies semarang d,MYMEMORY WARNING: YOU USED ALL AVAILABLE FREE TRANSLATIONS FOR TODAY. NEXT AVAILABLE IN  04 HOURS 47 MINUTES 55 SECONDS VISIT HTTPS://MYMEMORY.TRANSLATED.NET/DOC/USAGELIMITS.PHP TO TRANSLATE MORE
279,sbrnarna tarik tim aniespenasehat ad ketua pemuda pancasila taon 2019 pro jokowiada anggota bravo besut luhutmantan menteri agama resuffle fahrur rozi bhkn baru2 bilang tekan bubarin fpi mkanya di resuffleemng politik ubah arah dlam kejap,MYMEMORY WARNING: YOU USED ALL AVAILABLE FREE TRANSLATIONS FOR TODAY. NEXT AVAILABLE IN  04 HOURS 47 MINUTES 53 SECONDS VISIT HTTPS://MYMEMORY.TRANSLATED.NET/DOC/USAGELIMITS.PHP TO TRANSLATE MORE
280,capres langgar ham tua seperti anak kecil suka joged marah cawapres ilega belimbjng karbitan bocil,presidential candidate violates old ham like a child likes to jog angry vice president ilega belimbjng karbitan bocil
281,buka anies imin siapa yang mau dukung gas,open anies imin who wants to support the gas
282,benar pak anies kalau tanggap makin besar kepala si fahri,MYMEMORY WARNING: YOU USED ALL AVAILABLE FREE TRANSLATIONS FOR TODAY. NEXT AVAILABLE IN  04 HOURS 47 MINUTES 48 SECONDS VISIT HTTPS://MYMEMORY.TRANSLATED.NET/DOC/USAGELIMITS.PHP TO TRANSLATE MORE
283,buka 6000 kuota jadi saksi tapis dekat rumah milu 14 februari 2024 datang sayaarat 1 punya ktapi kab bogor benefit 1 fee saksi 2 asuransi jiwa amp celaka 3 info wa 62 895630988838 izz anies saksi tapis,open 6000 quota so witness filter near the house milu 14 februari 2024 come iarat 1 have ktapi district bogor benefit 1 fee witness 2 life insurance & wretched 3 info wa 62 895630988838 izz anies witness filter
284,tanya desak anies lanjut,MYMEMORY WARNING: YOU USED ALL AVAILABLE FREE TRANSLATIONS FOR TODAY. NEXT AVAILABLE IN  04 HOURS 47 MINUTES 45 SECONDS VISIT HTTPS://MYMEMORY.TRANSLATED.NET/DOC/USAGELIMITS.PHP TO TRANSLATE MORE
285,pilagiub 2017 anies jadi gelandang,MYMEMORY WARNING: YOU USED ALL AVAILABLE FREE TRANSLATIONS FOR TODAY. NEXT AVAILABLE IN  04 HOURS 47 MINUTES 43 SECONDS VISIT HTTPS://MYMEMORY.TRANSLATED.NET/DOC/USAGELIMITS.PHP TO TRANSLATE MORE
286,lebih bersayaukur ga jadi milih anies jd nya golput much better jd nya milih 02 wkwk,MYMEMORY WARNING: YOU USED ALL AVAILABLE FREE TRANSLATIONS FOR TODAY. NEXT AVAILABLE IN  04 HOURS 47 MINUTES 41 SECONDS VISIT HTTPS://MYMEMORY.TRANSLATED.NET/DOC/USAGELIMITS.PHP TO TRANSLATE MORE
287,no 1 for anies baswedan bisamaillah moga allah beri kuat sangat dasayaat,MYMEMORY WARNING: YOU USED ALL AVAILABLE FREE TRANSLATIONS FOR TODAY. NEXT AVAILABLE IN  04 HOURS 47 MINUTES 40 SECONDS VISIT HTTPS://MYMEMORY.TRANSLATED.NET/DOC/USAGELIMITS.PHP TO TRANSLATE MORE
288,ndarie otakamuu trnyata cekak rupa apa nunggu mati dl br anies nyapreslah sj serakah dn ambisius klewatan kalah 4x nyapres msh ambisi nyapres lo kira indonesia tidak orang pintar mlh gibran bau kencur langgar konstitusi kau diam,MYMEMORY WARNING: YOU USED ALL AVAILABLE FREE TRANSLATIONS FOR TODAY. NEXT AVAILABLE IN  04 HOURS 47 MINUTES 38 SECONDS VISIT HTTPS://MYMEMORY.TRANSLATED.NET/DOC/USAGELIMITS.PHP TO TRANSLATE MORE
289,suruh untidakap debat dua depan anies biar aemua tau benar nya berani gak kalau anies bicara beberapa kali itu,MYMEMORY WARNING: YOU USED ALL AVAILABLE FREE TRANSLATIONS FOR TODAY. NEXT AVAILABLE IN  04 HOURS 47 MINUTES 37 SECONDS VISIT HTTPS://MYMEMORY.TRANSLATED.NET/DOC/USAGELIMITS.PHP TO TRANSLATE MORE
290,misal misal pak nyalon presiden 7x trus kapan pak anies nyalonin presiden bukan janji pak anies gak nyalon 2019 ya emang laku umur hidup,MYMEMORY WARNING: YOU USED ALL AVAILABLE FREE TRANSLATIONS FOR TODAY. NEXT AVAILABLE IN  04 HOURS 47 MINUTES 35 SECONDS VISIT HTTPS://MYMEMORY.TRANSLATED.NET/DOC/USAGELIMITS.PHP TO TRANSLATE MORE
291,anies tri pecat gubernur gagal banyak kasus apbd lebih pinter omong ga kerja daesang gaco,MYMEMORY WARNING: YOU USED ALL AVAILABLE FREE TRANSLATIONS FOR TODAY. NEXT AVAILABLE IN  04 HOURS 47 MINUTES 33 SECONDS VISIT HTTPS://MYMEMORY.TRANSLATED.NET/DOC/USAGELIMITS.PHP TO TRANSLATE MORE
292,pernah sia sia semua juang pak anies,MYMEMORY WARNING: YOU USED ALL AVAILABLE FREE TRANSLATIONS FOR TODAY. NEXT AVAILABLE IN  04 HOURS 47 MINUTES 32 SECONDS VISIT HTTPS://MYMEMORY.TRANSLATED.NET/DOC/USAGELIMITS.PHP TO TRANSLATE MORE
293,muntidakin ini maksud anies ordal surat benar pak menag kalau benar koq gin,MYMEMORY WARNING: YOU USED ALL AVAILABLE FREE TRANSLATIONS FOR TODAY. NEXT AVAILABLE IN  04 HOURS 47 MINUTES 30 SECONDS VISIT HTTPS://MYMEMORY.TRANSLATED.NET/DOC/USAGELIMITS.PHP TO TRANSLATE MORE
294,ulama a b c santri deklarasi dukung yes makin byk dukung tak bendung ulama d e f deklarasi dukung yes satu putar itjima ulama uas dukung anies politik identitas senyumin,MYMEMORY WARNING: YOU USED ALL AVAILABLE FREE TRANSLATIONS FOR TODAY. NEXT AVAILABLE IN  04 HOURS 47 MINUTES 29 SECONDS VISIT HTTPS://MYMEMORY.TRANSLATED.NET/DOC/USAGELIMITS.PHP TO TRANSLATE MORE
295,di permasalahin omong anies bilang lama pak calon presiden maju pilpres saya tidak mau mentidakhianati pak amp skrg malah maju pilpres brg janji mana gamau maju pilpres ada maju pilpres,MYMEMORY WARNING: YOU USED ALL AVAILABLE FREE TRANSLATIONS FOR TODAY. NEXT AVAILABLE IN  04 HOURS 47 MINUTES 27 SECONDS VISIT HTTPS://MYMEMORY.TRANSLATED.NET/DOC/USAGELIMITS.PHP TO TRANSLATE MORE
296,waktu dukung anies jakarta gitu saat jakarta jadi menakuntukan anies malah beberapa kali datang meresamaikan gereja,MYMEMORY WARNING: YOU USED ALL AVAILABLE FREE TRANSLATIONS FOR TODAY. NEXT AVAILABLE IN  04 HOURS 47 MINUTES 25 SECONDS VISIT HTTPS://MYMEMORY.TRANSLATED.NET/DOC/USAGELIMITS.PHP TO TRANSLATE MORE
297,sp dua kau jadi capres tiga kau jadi gubernur anies baswedan ab siap bang apa pilih sp kita salam sp ab salam sejak gondangdia jalin komunikasi ab kemudian usaha menjantidakau pdip pranowo,MYMEMORY WARNING: YOU USED ALL AVAILABLE FREE TRANSLATIONS FOR TODAY. NEXT AVAILABLE IN  04 HOURS 47 MINUTES 24 SECONDS VISIT HTTPS://MYMEMORY.TRANSLATED.NET/DOC/USAGELIMITS.PHP TO TRANSLATE MORE
298,kan nyata anis pilpres 2019 anies jabat gubernur saat saya dukung,MYMEMORY WARNING: YOU USED ALL AVAILABLE FREE TRANSLATIONS FOR TODAY. NEXT AVAILABLE IN  04 HOURS 47 MINUTES 22 SECONDS VISIT HTTPS://MYMEMORY.TRANSLATED.NET/DOC/USAGELIMITS.PHP TO TRANSLATE MORE
299,habis bikin polling trus gali kubur sendiri sekarang kumat,MYMEMORY WARNING: YOU USED ALL AVAILABLE FREE TRANSLATIONS FOR TODAY. NEXT AVAILABLE IN  04 HOURS 47 MINUTES 21 SECONDS VISIT HTTPS://MYMEMORY.TRANSLATED.NET/DOC/USAGELIMITS.PHP TO TRANSLATE MORE
300,bukan tuding ikut vidwo die bat baik biar ga gagal fokus anies pak bilang saya kalau g kuat selamat bagai oposaudarii arti bilang pak sendiri ko marah,MYMEMORY WARNING: YOU USED ALL AVAILABLE FREE TRANSLATIONS FOR TODAY. NEXT AVAILABLE IN  04 HOURS 47 MINUTES 19 SECONDS VISIT HTTPS://MYMEMORY.TRANSLATED.NET/DOC/USAGELIMITS.PHP TO TRANSLATE MORE
301,maluuu yaa mett emmng begonoo melet2koq nyalahin dukung anies uda 4 kali nyalonin loch hetrik aj 3 saudaraww omgggggg,MYMEMORY WARNING: YOU USED ALL AVAILABLE FREE TRANSLATIONS FOR TODAY. NEXT AVAILABLE IN  04 HOURS 47 MINUTES 17 SECONDS VISIT HTTPS://MYMEMORY.TRANSLATED.NET/DOC/USAGELIMITS.PHP TO TRANSLATE MORE
302,biarpun habib rizieq gak jadi dukung anies mereka tetap gak milih anies preketek gombal mukiyo,MYMEMORY WARNING: YOU USED ALL AVAILABLE FREE TRANSLATIONS FOR TODAY. NEXT AVAILABLE IN  04 HOURS 47 MINUTES 16 SECONDS VISIT HTTPS://MYMEMORY.TRANSLATED.NET/DOC/USAGELIMITS.PHP TO TRANSLATE MORE
303,andarie tanya apa gak sadar bawasannya rakyat indonesia mayoritas suka sama kalau probowo cerdas punya moral akhlak etika jadi pentidakhianat kemarin keluar kabinet mau nyapres wakil anies in sayaa allah jadi presiden,MYMEMORY WARNING: YOU USED ALL AVAILABLE FREE TRANSLATIONS FOR TODAY. NEXT AVAILABLE IN  04 HOURS 47 MINUTES 14 SECONDS VISIT HTTPS://MYMEMORY.TRANSLATED.NET/DOC/USAGELIMITS.PHP TO TRANSLATE MORE
304,beberapa lembaga survey bayar hasil memenantidakan demikian hebat tekel anies bagai cara licik padahal bakal kalah lambaga survey mereka,MYMEMORY WARNING: YOU USED ALL AVAILABLE FREE TRANSLATIONS FOR TODAY. NEXT AVAILABLE IN  04 HOURS 47 MINUTES 13 SECONDS VISIT HTTPS://MYMEMORY.TRANSLATED.NET/DOC/USAGELIMITS.PHP TO TRANSLATE MORE
305,samaenjak pak prabs milih gibran jdi wakil lagisg mikir2 lagi milih siapa pasca debat pikir buat milih pak anies deh eh nongol brita ginian auto fix ga pilih kalau partai banteng sih emg cape ama tintidakah nyonya besar nya,MYMEMORY WARNING: YOU USED ALL AVAILABLE FREE TRANSLATIONS FOR TODAY. NEXT AVAILABLE IN  04 HOURS 47 MINUTES 11 SECONDS VISIT HTTPS://MYMEMORY.TRANSLATED.NET/DOC/USAGELIMITS.PHP TO TRANSLATE MORE
306,jelas anies rasayaid baswedan in the best,MYMEMORY WARNING: YOU USED ALL AVAILABLE FREE TRANSLATIONS FOR TODAY. NEXT AVAILABLE IN  04 HOURS 47 MINUTES 10 SECONDS VISIT HTTPS://MYMEMORY.TRANSLATED.NET/DOC/USAGELIMITS.PHP TO TRANSLATE MORE
307,gimana dah mulai bener arti survey lapang anies sedang roket,MYMEMORY WARNING: YOU USED ALL AVAILABLE FREE TRANSLATIONS FOR TODAY. NEXT AVAILABLE IN  04 HOURS 47 MINUTES 08 SECONDS VISIT HTTPS://MYMEMORY.TRANSLATED.NET/DOC/USAGELIMITS.PHP TO TRANSLATE MORE
308,sungguh maxwin hanya orang orang selalu coba,MYMEMORY WARNING: YOU USED ALL AVAILABLE FREE TRANSLATIONS FOR TODAY. NEXT AVAILABLE IN  04 HOURS 47 MINUTES 06 SECONDS VISIT HTTPS://MYMEMORY.TRANSLATED.NET/DOC/USAGELIMITS.PHP TO TRANSLATE MORE
309,ngoceh2 politik identitas pak anies orang2 kafir bodoh sangat bodoh takut pak anies jadi presiden islamophobia israel minded padahal pendeta pastor aku pluralitas integritas pak anies dijakarta pasti neo komunis main,MYMEMORY WARNING: YOU USED ALL AVAILABLE FREE TRANSLATIONS FOR TODAY. NEXT AVAILABLE IN  04 HOURS 47 MINUTES 05 SECONDS VISIT HTTPS://MYMEMORY.TRANSLATED.NET/DOC/USAGELIMITS.PHP TO TRANSLATE MORE
310,anies emng gag level sama jilat kuasa sorry ye sorry ye,MYMEMORY WARNING: YOU USED ALL AVAILABLE FREE TRANSLATIONS FOR TODAY. NEXT AVAILABLE IN  04 HOURS 47 MINUTES 03 SECONDS VISIT HTTPS://MYMEMORY.TRANSLATED.NET/DOC/USAGELIMITS.PHP TO TRANSLATE MORE
311,aku suka part cak imin belakang kayak on set mau bareng ma anies soal gera,MYMEMORY WARNING: YOU USED ALL AVAILABLE FREE TRANSLATIONS FOR TODAY. NEXT AVAILABLE IN  04 HOURS 47 MINUTES 02 SECONDS VISIT HTTPS://MYMEMORY.TRANSLATED.NET/DOC/USAGELIMITS.PHP TO TRANSLATE MORE
312,bentar belsajar sama anies bang,MYMEMORY WARNING: YOU USED ALL AVAILABLE FREE TRANSLATIONS FOR TODAY. NEXT AVAILABLE IN  04 HOURS 47 MINUTES 00 SECONDS VISIT HTTPS://MYMEMORY.TRANSLATED.NET/DOC/USAGELIMITS.PHP TO TRANSLATE MORE
313,dulu abang lawan ketidakadilan hukum pecat partai alas gua ikut bela karena benar skrg malah dukung hasil langgar hukum etika gua ikut bela benar kurang tegas apa coba sikap gua pegang teguh supremasi hukum,MYMEMORY WARNING: YOU USED ALL AVAILABLE FREE TRANSLATIONS FOR TODAY. NEXT AVAILABLE IN  04 HOURS 46 MINUTES 58 SECONDS VISIT HTTPS://MYMEMORY.TRANSLATED.NET/DOC/USAGELIMITS.PHP TO TRANSLATE MORE
314,sempet datengin markas fpi n trnyt abis menang dia pidato pribumi menang yes ma dijadiin wapres is shit jkw dateng k 212 is also shit prabs dluan bawa2 politik identitas milu 2014 is also shit anies kena konsekuensi ride the wave terima aj,MYMEMORY WARNING: YOU USED ALL AVAILABLE FREE TRANSLATIONS FOR TODAY. NEXT AVAILABLE IN  04 HOURS 46 MINUTES 57 SECONDS VISIT HTTPS://MYMEMORY.TRANSLATED.NET/DOC/USAGELIMITS.PHP TO TRANSLATE MORE
315,sih mudah ssaja akan pilih kok lama pks dukung anies anies dukung pa 212,MYMEMORY WARNING: YOU USED ALL AVAILABLE FREE TRANSLATIONS FOR TODAY. NEXT AVAILABLE IN  04 HOURS 46 MINUTES 55 SECONDS VISIT HTTPS://MYMEMORY.TRANSLATED.NET/DOC/USAGELIMITS.PHP TO TRANSLATE MORE
316,ulama tokoh agama semua agama apa 1 agama oh god mau org bilang pilih anies gausa takut sama pk pk kecil2 rem bat anjer aneh isi,MYMEMORY WARNING: YOU USED ALL AVAILABLE FREE TRANSLATIONS FOR TODAY. NEXT AVAILABLE IN  04 HOURS 46 MINUTES 54 SECONDS VISIT HTTPS://MYMEMORY.TRANSLATED.NET/DOC/USAGELIMITS.PHP TO TRANSLATE MORE
317,kata siapa modal anies ndarie anies sampai hutang lho orang bisa maju pilagiub untung menang jadi lunas perlu kembali hutang modal jokowi 2012,MYMEMORY WARNING: YOU USED ALL AVAILABLE FREE TRANSLATIONS FOR TODAY. NEXT AVAILABLE IN  04 HOURS 46 MINUTES 52 SECONDS VISIT HTTPS://MYMEMORY.TRANSLATED.NET/DOC/USAGELIMITS.PHP TO TRANSLATE MORE
318,fakta kalimat pak anies sllu paling efisien segi efisiensi waktu padat informasi,MYMEMORY WARNING: YOU USED ALL AVAILABLE FREE TRANSLATIONS FOR TODAY. NEXT AVAILABLE IN  04 HOURS 46 MINUTES 51 SECONDS VISIT HTTPS://MYMEMORY.TRANSLATED.NET/DOC/USAGELIMITS.PHP TO TRANSLATE MORE
319,lo siapa berani bilang kelas firli ssaja ngak bukti anies korupsi malah firli bukti korupsi kamu belsajar dulu benar nak,MYMEMORY WARNING: YOU USED ALL AVAILABLE FREE TRANSLATIONS FOR TODAY. NEXT AVAILABLE IN  04 HOURS 46 MINUTES 49 SECONDS VISIT HTTPS://MYMEMORY.TRANSLATED.NET/DOC/USAGELIMITS.PHP TO TRANSLATE MORE
