content,text_tokens_stemmed,Label,Label NB,Label NB Average
Recommended buat ngajak anak2 main ke kebun binatang sekaligus ke pantai dan melihat atraksi lumba2,recommended ngajak anak2 main kebun binatang pantai atraksi lumba2,positif,positif,positif
Tempatnya bagus... Yg penting ditingkatkan lagi fasilitasnya... Safari beach jateng joos pokoknya,tempat bagus yg tingkat fasilitas safari beach jateng joos pokok,positif,positif,positif
"Seru rekomen buat ajak anak2 sekalian main ke pantai, animal shownya pinter banget, cuma bisa dicek kebersihan kandang di bagian afrika  baunya lumayan menusuk hidung ",seru rekomen ajak anak2 main pantai animal shownya pinter banget cek bersih kandang afrika bau lumayan tusuk hidung,positif,positif,positif
"Tempatnya cukup luas, tiket masuk kalo weekday 50K dan weekend 60K cukup okelah karena sudah termasuk bisa liat semua atraksi hewan berapa x pun. Kalau mau naik onta, gaja dan kuda atau atv bayar lagi. Itu juga sudah termasuk potongan beli ",tempat luas tiket masuk kalo weekday 50k weekend 60k oke liat atraksi hewan x onta gaja kuda atv bayar potong beli,positif,positif,positif
"Baru aja balik dari Safari Beach Jateng ini dan overall anak-anak puas dan happy, alhamdulillah ?? ",aja safari beach jateng overall anakanak puas happy alhamdulillah,positif,positif,positif
Mantap Jateng punya ginian.,mantap jateng ginian,positif,positif,positif
"Rekomendasi healing akhir pekan bareng anak dan keluarga , mini safari nya oke,",rekomendasi healing pekan bareng anak keluarga mini safari nya oke,positif,positif,positif
Bagus banyak binatang dan pertunjukan binatang serta pemandangan langsung ke pantai,bagus binatang tunjuk binatang pandang langsung pantai,positif,positif,positif
"Enaknya di sini sekali bayar tiket bs nonton animal presentation berkali2 tanpa bayar lagi ?? kemarin kami nonton dolphin 2x.
Utk tempat lumayan tapi masih jauh jika dibandingkan Safari yg di Prigen. Kamar ",enak bayar tiket bs nonton animal presentation berkali2 bayar kemarin nonton dolphin 2xutk lumayan banding safari yg prigen kamar,positif,positif,positif
"terus berkembang safari beach
makin cakep aja makin kesini",kembang safari beachmakin cakep aja kesini,positif,positif,positif
Alternatif wisata pantai yg dipadukan dg kebon binatang..ada tempat makan dan jajan jg..dan bisa pakai Qris..mantaap..,alternatif wisata pantai yg padu dg kebon binatangada makan jajan jgdan pakai qrismantaap,positif,positif,positif
Cafe nya enak buat duduk2 santaii tapi sayang makanannya semua kurang enak coba diperbaikin kualitasnya,cafe nya enak duduk2 santai sayang makan enak coba diperbaikin kualitas,positif,positif,positif
"Wisata keluarga
Ngajak anak pengen pantai, hewan, seru
Safari pantai ",wisata keluargangajak anak ken pantai hewan serusafari pantai,positif,positif,positif
"Bagus terdapat atraksi dan menghibur cocok untuk anak-anak. Jika hanya ingin lihat atraksi ini kalian bisa kunjungi saat hari sabtu (malam minggu) jam 19:00 (mungkin, karna saya kurang tau tepatnya jam berapa acara dimulai dan kebetulan ",bagus atraksi hibur cocok anakanak lihat atraksi kunjung sabtu malam minggu jam 1900 karna tau tepat jam acara,positif,positif,positif
Pantai yang indah dan indah di malam hari,pantai indah indah malam,positif,positif,positif
Pembelian online sama dilapangan kok beda harganya ka,beli online lapang beda harga ka,negatif,positif,positif
"kesini menjelang jam 3. nngga seberapa panas. keburu utk nntn pertunjukan lumba2, satwa2, akrobatik, dance.
tiket nya 60rb/org. dpt vocher makan/minum 20rb per org. pantai nya lumayan ",kesini jelang jam 3 nngga panas keburu utk nntn tunjuk lumba2 satwa2 akrobatik dancetiket nya 60rborg dpt vocher makanminum 20rb org pantai nya lumayan,positif,positif,positif
"Tempat rekreasi yg bagus utk keluarga,terutama anak""..,karena satu"" nya pantai yg ada pertunjukan ikan lumba"" seperti di pantai ancol jkt",rekreasi yg bagus utk keluargaterutama anakkarena nya pantai yg tunjuk ikan lumba pantai ancol jkt,positif,positif,positif
Saya ke sini malam hari menjelang jam 20 hanya sebentar sebelum tutup,malam jelang jam 20 sebentar tutup,positif,positif,positif
"Pertunjukkan satwa dan lumba lumba sangat menghibur. Fasilitas lengkap (mushola, tempat cuci, tempat makan dan toilet) semuamya bersih.
Tiket masuk ",tunjuk satwa lumba lumba hibur fasilitas lengkap mushola cuci makan toilet semuamya bersihtiket masuk,positif,positif,positif
"Kesan pertama kali dateng kek ""ini gimana konsepnya"" dan setelah masuk baru ngowoh ternyata ada kebun binatang di pinggir pantai. Waktunya review~ ",kesan kali dateng kek gimana konsep masuk ngowoh kebun binatang pinggir pantai review,positif,positif,positif
pantainya kurang rekomended.pertunjukan yg menarik hanya lumba2 ajjd harganya jd kurang worthbit,pantai rekomendedpertunjukan yg tarik lumba2 ajjd harga jd worthbit,negatif,positif,positif
Cocok untuk berlibur bersama keluarga,cocok libur keluarga,positif,positif,positif
"Keren bgt...
Dateng dari jam 9 pagi pulang sampe jam 9 malem, tapi tetep masih nagih",keren bgtdateng jam 9 pagi pulang sampe jam 9 malem tetep nagih,positif,positif,positif
"masih perlu banyak perbaikan, mungkin akan lebih bagus beberapa bulan lagi",baik bagus,negatif,positif,positif
Ada Lumba lumbaaa disiniii,lumba lumbaaa disiniii,positif,positif,positif
"Tempat yang bisa diputerin selama seharian bahkan sampe malem!
Tiket masuk dari gerbang awal desa sigandu dan masuk zoo mungkin sekitar Rp. ",diputerin hari sampe malemtiket masuk gerbang desa sigandu masuk zoo rp,positif,positif,positif
Lumayan bagus dan enaknya datang di sorehari suasana lebih nyaman,lumayan bagus enak sorehari suasana nyaman,positif,positif,positif
bagus tempat dan suasananya d sore dan malam hari,bagus suasana d sore malam,positif,positif,positif
"Pantai dikelola dengan baik oleh taman safari. Pantainya sendiri sih biasa saja, standar pantai pantura, namun dg pengelolaan yg baik suasananya jadi enak dan fasilitas memadai banget",pantai kelola taman safari pantai sih standar pantai pantura dg kelola yg suasana enak fasilitas pada banget,positif,positif,positif
"Ada banyak pertunjukan hewan, asal kesananya pas jadwal. Paling seru lihat pertunjukan lumba-lumba dan duduk di pantai",tunjuk hewan kesana pas jadwal seru lihat tunjuk lumbalumba duduk pantai,positif,positif,positif
Mantab..bersih nyaman dan indah,mantabbersih nyaman indah,positif,positif,positif
Safar beach Jateng ini masi dalam proses pengembangan. Untuk koleksi hewan terbatas namun cukup lengkap. Lumba2 dan atraksi Lumba2 adalah nilai jula terbaik disini. ,safar beach jateng mas proses kembang koleksi hewan batas lengkap lumba2 atraksi lumba2 nilai jula baik,positif,positif,positif
"Mahal gak sesuai sama harganya , Semua nya dikit dikit Bayar , tapi tidak sesuai , Naik Gajah 25.K, Cuma jalan 10 meter ???? ",mahal gak sesuai harga nya dikit dikit bayar sesuai gajah 25k jalan 10 meter,negatif,positif,positif
"Tempatnya indah, namun binatangya kurang bervariasi kurang banyak",tempat indah binatangya variasi,positif,positif,positif
Cocok untuk bertamasya,cocok tamasya,positif,positif,positif
"Bagus,anak2 pasti seneng",bagusanak2 neng,positif,positif,positif
Safari Kecil di Jawa Tengah,safari jawa,positif,positif,positif
"Wisata rekomended utk semua kalangan,, bisa mantai dan liat aneka koleksi hewan yg ada di safari beach,, harga tiket masuk 60 ribu sudah include voucher makan senilai 20 ribu yg bisa di tukar di stand khusus Penukaran voucher,, selain itu ",wisata rekomended utk kalang manta liat aneka koleksi hewan yg safari beach harga tiket masuk 60 ribu include voucher makan nila 20 ribu yg tukar stand khusus tukar voucher,positif,positif,positif
Udah 2x kesini. Masih tahap oembangunan. Tp sejauh ini menyenangkaaaaaaan,udah 2x kesini tahap oembangunan tp menyenangkaaaaaaan,positif,positif,positif
Wahana buat hiburan anak dan orang tua... kereeennn ?? ,wahana hibur anak orang tua kereeennn,positif,positif,positif
Mahal tiketnya tapi mendingan agak bersih,mahal tiket mending bersih,positif,positif,positif
"Tempat yg nyaman bt liburan sama anak-anak. Makin kesini juga makin bagus. Ada cafe nya juga, tiap malam Minggu juga ada pertunjukan fire dance. Recomended untuk liburan kluarga",yg nyaman bt libur anakanak kesini bagus cafe nya malam minggu tunjuk fire dance recomended libur kluarga,positif,positif,positif
"Recomended sih.. Komplit, ada pantai, ada pertunjukan lumba2, ada zoo mini. Klo kesini pagi² enak bngt, nikmati pantainya, terus lanjut nikmati yg lainnya.. Sayangnya klo udah siang terasa bngt ppananya",recomended sih komplit pantai tunjuk lumba2 zoo mini klo kesini pagi enak bngt nikmat pantai nikmat yg sayang klo udah siang bngt ppananya,positif,positif,positif
Bagus cocok untuk edukasi anak usia dini..pertunjukan sangat menghibur,bagus cocok edukasi anak usia dinipertunjukan hibur,positif,positif,positif
"Waktu kami kesana sepertinya masih dalam tahap pembangunan sehingga ada bagian jalan yang masih bebatuan sehingga terkesan agak kotor, kurang rapi, dan kurang nyaman. ",kesana tahap bangun jalan bebatuan kes kotor rapi nyaman,positif,positif,positif
Macam hewannya belum lengkap...,hewan lengkap,positif,positif,positif
Antraksi Lumba lumba bagus,antraks lumba lumba bagus,positif,positif,positif
Pantainya bersih,pantai bersih,positif,positif,positif
"Pantai bersih
Parkir luas",pantai bersihparkir luas,positif,positif,positif
Antraksi binatang,antraks binatang,positif,positif,positif
Salah satu destinasi mini zoo disekitar Tegal Pemalang  Pekalongan & Batang,salah destinasi mini zoo sekitar tegal malang kalong batang,positif,positif,positif
"Tempat wisata edukasi yg bagus walopun blm sepenuhnya jadi.. tapiii kita sekeluarga enjoy & anak2 happy .. menyaksikan pertunjukan satwa , lumba2 , gajah, unta dll",wisata edukasi yg bagus walopun blm sepenuh tapiii keluarga enjoy anak2 happy saksi tunjuk satwa lumba2 gajah unta dll,positif,positif,positif
"Masih jauh fasilitasnya kalau dibandingkan TSI yang lain. Sepertinya masih tahap pengembangan, restoran juga sedang dibangun. Binatang2nya belum terlalu variatif, yg paling menarik adalah naik gajah & pertunjukan lumba2. Selain itu lokasinya persis di pinggir pantai jadi ada suasana berbeda dibanding TSI yang lain",fasilitas banding tsi tahap kembang restoran bangun binatang2nya variatif yg tarik gajah tunjuk lumba2 lokasi persis pinggir pantai suasana beda banding tsi,positif,positif,positif
Terlalu mahal untuk makananya,mahal makananya,positif,positif,positif
"Tempatnya asik, ada pantainya, cocok buat anak"" untk mengenal satwa..",tempat asik pantai cocok anak untk kenal satwa,positif,positif,positif
"Mini safari, keliling dan kenali beragam satwa dari 5 benua, termasuk beberapa satwa langka dari Indonesia. Wahana permainan untuk keluarga dengan berbagai permainan yang mengasyikkan. Bisa juga menikmati desiran ombak pantai.",mini safari keliling kenal agam satwa 5 benua satwa langka indonesia wahana main keluarga main asyik nikmat desir ombak pantai,positif,positif,positif
Sudah layak menjadi destinasi wisata  nasional,layak destinasi wisata nasional,positif,positif,positif
Pelayanan foto bareng binatang buruk dan Kaku,layan foto bareng binatang buruk kaku,negatif,positif,positif
Tempat untuk nyore hari,nyore,positif,positif,positif
"Tempat yang sangat bagus untuk pergi bersama anak-anak.. biaya masuk sangat terjangkau, pemandangannya menakjubkan karena dekat pantai.. beberapa tempat sedang dalam renovasi berharap akan segera ada lebih banyak hewan & pertunjukan menarik.. pasti akan berkunjung lagi setelah itu renovasi selesai",bagus pergi anakanak biaya masuk jangkau pandang takjub pantai renovasi harap hewan tunjuk tarik kunjung renovasi selesai,positif,positif,positif
Hanya lewat,,positif,positif,positif
"Bagi saya, konsep safari beach baik dari sisi wahana dan lokasi nya kalau bisa dioptimalkan bisa menjadi tempat wisata yang paling menarik di Jawa Tengah. ",konsep safari beach sisi wahana lokasi nya optimal wisata tarik jawa,negatif,positif,positif
Luar biasa,,positif,positif,positif
Tempatnya cukup bagus bersih.pemandangan pantai dan ada beberapa satwa dipelihara disana..ada kuliner....terjangkau,tempat bagus bersihpemandangan pantai satwa pelihara disanaada kulinerterjangkau,positif,positif,positif
"Mini zoo
Dolphin center
Beach ",mini zoodolphin centerbeach,positif,positif,positif
"Tempat yang bagus untuk liburan bersama keluarga,,
Banyak edukasi disini,, pertunjukan lumba2,, aneka binatang, dll
Cuma harga food & drink nya aja yg harus di turunin kayaknya?? ",bagus libur keluargabanyak edukasi tunjuk lumba2 aneka binatang dllcuma harga food drink nya aja yg turunin kayak,positif,positif,positif
Mantab wisata edukasi,mantab wisata edukasi,positif,positif,positif
"Bagus banget buat edukasi anak terkait satwa, koleksi satwa juga beragam, mulai dari dalam maupun luar negeri, aneka jenis ikan, reptil, burung, maupun mamalia darat. yang menjadi primadona di sini adalah pertunjukan lumba-lumba si mamalia ",bagus banget edukasi anak kait satwa koleksi satwa agam negeri aneka jenis ikan reptil burung mamalia darat primadona tunjuk lumbalumba si mamalia,positif,positif,positif
"Taman rekreasi yg familly bgt ini mah
Anak bisa happy liat binatang, liat atraksi binatang,,,
Orangtua bisa bersantai d tepi pantai",taman rekreasi yg familly bgt mahanak happy liat binatang liat atraksi binatangorangtua santa d tepi pantai,positif,positif,positif
"Bagus, hewan hewan banyak, pertujukkan seru, tapi masih kurang bersih di beberapa tempat seperti di dekat arena apv masih bau got. Beberapa pintu toilet dekat pertujukkan lumba lumba rusak, jadi harus bawa teman untuk jaga jaga.",bagus hewan hewan pertujukkan seru bersih arena apv bau got pintu toilet pertujukkan lumba lumba rusak bawa teman jaga jaga,positif,positif,positif
"Tempat wisata edukasi untuk keluarga.
Cocok untuk berlibur sambil belajar, untuk kunjungan studi sekolah (kelompok belajar (KB), TK, SD & SMP) ",wisata edukasi keluargacocok libur ajar kunjung studi sekolah kelompok ajar kb tk sd smp,positif,positif,positif
"Cocok banget untuk liburan bareng keluarga. Tiket 50-60 ribu bisa dibilang murah banget. Ada banyak pertunjukan, hewan, pastinya pantainya juga bersih, makanannya cukup murah karena ada potongan dri tiket masuk. Rekomended banget pokoknya..",cocok banget libur bareng keluarga tiket 5060 ribu bilang murah banget tunjuk hewan pasti pantai bersih makan murah potong dri tiket masuk rekomended banget pokok,positif,positif,positif
Menghibur..,hibur,positif,positif,positif
"Atraksi dolphin yg paling memikat pengunjung,kemudian ada atraksi burung pemangsa. Kedua atraksi memiliki pelatih"" yg TOP.?? ",atraksi dolphin yg mikat pengunjungkemudian atraksi burung mangsa atraksi milik latih yg top,positif,positif,positif
Tempat yg seru untuk bermain bersama anak2,yg seru main anak2,positif,positif,positif
"Recommend buat mengisi liburan ...
Banyak wahana buat anak2
Ada atraksi lumba lumba , aneka satwa , atraksi burung pemangsa , atraksi ",recommend isi libur wahana anak2ada atraksi lumba lumba aneka satwa atraksi burung mangsa atraksi,positif,positif,positif
"Tempat rekreasi bersama keluarga yg dekat dengan pantai, ada atraksi lumba-lumba, atraksi burung pemangsa,dll  ngk boleh makanan dr luar karena bahaya buat satwa",rekreasi keluarga yg pantai atraksi lumbalumba atraksi burung pemangsadll ngk makan dr bahaya satwa,positif,positif,positif
"antrian tdk jelas, petugas juga nyolot santai napa si...
saran aja untuk antrian dikasih garis mngkin kaya di bank biar rapi,",antri tdk tugas nyolot santai napa sisaran aja antri kasih garis mngkin kaya bank biar rapi,negatif,positif,positif
"Lokasi mudah di jangkau tidak terlalu macet...dsekitaran pantai banyak rumah makan khas laut...permainan buat anak lumayan komplit,koleksi kebun binatang belom smwnya msh ada pembangunan, sarana toilet dan musholah bersih, ada wisata pantai ",lokasi mudah jangkau macetdsekitaran pantai rumah makan khas lautpermainan anak lumayan komplitkoleksi kebun binatang bom smwnya msh bangun sarana toilet musholah bersih wisata pantai,positif,positif,positif
"Tolong buat pengelolah untuk hrga makanan,a yg masuk akal, masa nasi chiken sama teh tawar 2 hrga 50rb",tolong elo hrga makanana yg masuk akal nasi chiken teh tawar 2 hrga 50rb,negatif,positif,positif
"harga tiket 60k mahal,voucher makan 20rb,4orang suruh nambah 40rb,es teh harga 10rb,menyesal ke sini...pertama dan terahir kali....
ga boleh bawa makanan,,,harga makanan sama minumam super mahal banget,ga ngotak ",harga tiket 60k mahalvoucher makan 20rb4orang suruh nambah 40rbes teh harga 10rbmenyesal sinipertama terahir kaliga bawa makananharga makan minumam super mahal bangetga ngotak,negatif,positif,positif
"Sangat tidak RECOMENDED..
Masuk dikasih voucher makan tp aturannya ribet sekali dan SANGAT TIDAK BERGUNA.
Tidak ada komunikasi yg jelas untuk pengunjung..
Jalan ke tempat hewan2 koyok kali sat, rak jelas blas...!!!",recomendedmasuk kasih voucher makan tp atur ribet bergunatidak komunikasi yg pengunjungjalan hewan2 koyok kali sat rak blas,negatif,positif,positif
Sayang kurang terawat. Tp srkarang sudah lebih bagus dr waktu awal2. Uda ada area pantai banyak makanan dan anak2 pada banyak main pasir n renang,sayang awat tp srkarang bagus dr awal2 uda area pantai makan anak2 main pasir n renang,positif,positif,positif
Safari beach batang berada di kabupaten Pekalongan. Tempatnya bersih nyaman dan estetik. Setiap pertunjukan tidak bertabrakan jamnya.,safari beach batang kabupaten kalong tempat bersih nyaman estetik tunjuk tabrak jam,positif,positif,positif
Petugas semua profesional berkelas pendidikan setara wisata pengelolaan kelas kota. Tapi bagian loket karcis yang wanita kek tai cemberut tidak ada kata hye selamat datang atau sekedar senyum. Selain itu petugas ramah profesional.  Sayang ,tugas profesional kelas didik tara wisata kelola kelas kota loket karcis wanita kek tai cemberut hye selamat dar senyum tugas ramah profesional sayang,positif,positif,positif
Mie ayam... :D :D,mie ayam d d,positif,positif,positif
"Kelas menengah mending puasa deh, krna pengunjung dilarang bawa makanan dari luar alhasil beli makanan di dalam harganya muahil bingit hampir 3x hrga diwarung,kalo gak segera dibenahi pengunjung bisa sepi",kelas tengah mending puasa deh krna unjung larang bawa makan alhasil beli makan harga muahil bingit 3x hrga diwarungkalo gak benah unjung sepi,negatif,positif,positif
"Tertata rapi, pilihan makanan lumayan banyak, banyak spot foto tapi sayang jam tutupnya terlalu awal",tata rapi pilih makan lumayan spot foto sayang jam tutup,positif,positif,positif
"Seru, tempat wisata yang keren di kabupaten batang",seru wisata keren kabupaten batang,positif,positif,positif
"Bagus ada seller food berbagai jenis dari beverage and food , fasilitas umum tempat duduk yg paling penting kamar mandi dan mushola tersedia , ada berbagai jenis hewan beo ,unta , gajah ,monkey dll",bagus seller food jenis beverage and food fasilitas duduk yg kamar mandi mushola sedia jenis hewan beo unta gajah monkey dll,positif,positif,positif
"Ramah buat anak
Cuman sayang makan di dalam mahalnya luar biasa udh mahal ga enak ",ramah anakcuman sayang makan mahal udh mahal ga enak,positif,positif,positif
Tempatnya nyaman banget untuk duduk' di pinggir pantai,tempat nyaman banget duduk pinggir pantai,positif,positif,positif
Perlu sediakan Tempat bilas yang tertutup,sedia bilas tutup,positif,positif,positif
"Paket komplit rekreasi anak,emak,keluarga...recomended",paket komplit rekreasi anakemakkeluargarecomended,positif,positif,positif
"Pantai dan kebun binatang (Animal shows, Dolphin, Elephant, etc) menjadi pilihan menarik untuk liburan, apalagi membawa anak-anak dan kerabat! Tempat yg cocok untuk rehat sejenak. Lingkungan bersih dan asri, harga jajanan terjangkau, dan tiket yang murah?????? ",pantai kebun binatang animal shows dolphin elephant etc pilih tarik libur bawa anakanak kerabat yg cocok rehat lingkung bersih asri harga jajan jangkau tiket murah,positif,positif,positif
Bagus pas buat liburan anak2,bagus pas libur anak2,positif,positif,positif
"Alhamdulillah suka sekali dg suasana pantainya jadi bikin rileks pikiran
apalagi liat atraksi lumba lumba bikin anak anak senang dan bapak pun bahagia.
semoga ada rizki banyak lagi untuk bisa membawa keluarga besar ke SAFARI BEACH BATANG JAWA TENGAH lagi
aamiin",alhamdulillah suka dg suasana pantai bikin rileks pikiranapalagi liat atraksi lumba lumba bikin anak anak senang bahagiasemoga rizki bawa keluarga safari beach batang jawa lagiaamiin,positif,positif,positif
Menyenangkan,senang,positif,positif,positif
"Pengalaman yg seru buat anak2, dg tempat cukup bagus meskipun ada beberapa fasilitas seperti jalan menuju kebun binatangnya yang harus diperbaiki. Tp selain itu semua menurut saya cukup worth it. Dengan harga yang murah tapi sudah bisa ",alam yg seru anak2 dg bagus fasilitas jalan kebun binatang baik tp worth it harga murah,positif,positif,positif
"Wisatanya oke, cuma tiketnya mahal, nakanannya MAHALLL malah ga enak, mie ayam nya hambar mie nya lembek, ayamnya dikit  sayurannya secuil, kuahnya bening kek air rebusan, es teh mahall 10.000, eskrim kirain wals ternyata bukan, cuma foto sm lumba2 pake hp sendiri bayar 25rb, ga ada harimau, singa, jerapah, kudanil dll...membosankan",wisata oke tiket mahal nakanannya mahalll ga enak mie ayam nya hambar mie nya lembek ayam dikit sayur cuil kuah bening kek air rebus es teh mahall 10000 eskrim kirain wals foto sm lumba2 pake hp bayar 25rb ga harimau singa jerapah kudanil dllmembosankan,negatif,positif,positif
recomended....okey smua...k,recomendedokey smuak,positif,positif,positif
"Wisata edukasi yang cocok untuk anak-anak.. hewan-hewan cukup lengkap, ada gajah, unta, rusa, banteng, ular, ikan, burung dll..
Ada pertunjukan edukasi lumba-lumba, burung pemangsa, dll yang memiliki jadwal ",wisata edukasi cocok anakanak hewanhewan lengkap gajah unta rusa banteng ular ikan burung dllada tunjuk edukasi lumbalumba burung mangsa dll milik jadwal,positif,positif,positif
Pantai yang indah dan menyenangkan,pantai indah senang,positif,positif,positif
Banyak yang harus ditingkatkan,tingkat,positif,positif,positif
Seru,seru,positif,positif,positif
Bagustapi Sayang sekalidi sini banyak orang yg merokokpadahal kawasan banyak anak2harusnya lebih di tertibkan lg mengenai aturan ini agar anak2/balita/batita lebih nyaman.,bagustapi sayang sekalidi orang yg merokokpadahal kawasan anak2harusnya tertib lg atur anak2balitabatita nyaman,negatif,positif,positif
"Tempatnya belum tertata,masih banyak jalan berbatu,dan pertunjukannya masih biasa saja,tempat binatangnya juga seperti tidak terawat,tempat ini enaknya nyambung dengan pantai,anak2 kalau sdh bosan di kebun binatang bisa langsung main ke pantai.",tempat tertatamasih jalan berbatudan tunjuk sajatempat binatang terawattempat enak nyambung pantaianak2 sdh bosan kebun binatang langsung main pantai,positif,positif,positif
"Banyak tempat duduk dan jajanan, tapi sayang belum bisa cashless, tidak tersedia ATM juga. Harus siap uang cash banyak kalau ke sini. Cocok untuk bawa anak dengan pertunjukan lumba-lumba dan burung, bisa menunggangi gajah, unta, dan kuda ",duduk jajan sayang cashless sedia atm uang cash cocok bawa anak tunjuk lumbalumba burung tunggang gajah unta kuda,positif,positif,positif
"Tiket masuk per orang 60rb dapat voucher makan 20rb, masih perbaikan resto, ada minizoo, pantai, hewan tunggang, feeding, atraksi hewan2, dan atraksi utama dolphin mantab, kesukaan anak2 pas coach terbang kayak ironman ?????? ",tiket masuk orang 60rb voucher makan 20rb baik resto minizoo pantai hewan tunggang feeding atraksi hewan2 atraksi utama dolphin mantab suka anak2 pas coach terbang kayak ironman,positif,positif,positif
seru,seru,positif,positif,positif
"Jangan pernah merasa gagal saat belajar,  itu adalah bagian dari proses...",gagal ajar proses,positif,positif,positif
"Tempat bersih, pelayanannya ramah ramah",bersih layan ramah ramah,positif,positif,positif
"Belum jadi 100%, masih tahap pembangunan... tapi tidak masalah.. fasilitas oke.. HTM weekend 60rb/orang, anak diatas 2tahun sudah bayar sendiri..",100 tahap bangun fasilitas oke htm weekend 60rborang anak atas 2tahun bayar,positif,positif,positif
Tempat wisata rekomendasi di Batang,wisata rekomendasi batang,positif,positif,positif
"Tempatnya bagus, perbanyak tempat duduk buat pengunjung soalnya dikit banget tempat duduknya buat istirahat",tempat bagus banyak duduk unjung dikit banget duduk istirahat,positif,positif,positif
"Asik banget buat liburan bareng keluarga,, mantap pokoknya",asik banget libur bareng keluarga mantap pokok,positif,positif,positif
"Pantai nya bagus, dengan berbagai macam koleksi satwa yang tersedia, pertunjukan lumba²
Sangat cocok untuk liburan keluarga, terdapat beberapa pilihan stand makanan dan ",pantai nya bagus koleksi satwa sedia tunjuk lumbasangat cocok libur keluarga pilih stand makan,positif,positif,positif
"Tempatnya lumayan bagus,luas dan binatangnya lumayan menghibur",tempat lumayan bagusluas binatang lumayan hibur,positif,positif,positif
"Puas banget main kesini, apalagi ajak anak anak bakalan seneng. Menggabungkan pantai dengan kebun binatang. Saat menuju ke pantai akan dikenakan tiket 5rb/org untuk memasuki kawasan pantai sigandu, lalu memasuki area safari beach 1 orang ",puas banget main kesini ajak anak anak neng gabung pantai kebun binatang pantai kena tiket 5rborg pasuk kawasan pantai sigandu pasuk area safari beach 1 orang,positif,positif,positif
Semakin bagus,bagus,positif,positif,positif
Baguss,baguss,positif,positif,positif
